MISA meInvoice Summary$Tổng quan meInvoice và chức năng$MISA meInvoice vẫn luôn là phần mềm hóa đơn điện tử tốt nhất được cả chính phủ và các doanh nghiệp tư nhân lựa chọn. Phần mềm hóa đơn điện tử đầu tiên và duy nhất tại Việt Nam ứng dụng công nghệ Blockchain đảm bảo an toàn, bảo mật và chống làm giả hóa đơn hàng đầu thế giới.\nĐiều khiến meInvoice trở thành phần mềm hóa đơn điện tử tốt nhất chính là hệ sinh thái các phần mềm từ kế toán đến doanh nghiệp: phần mềm kế toán MISA, phần mềm kế toán dịch vụ, kê khai – nộp tờ khai thuế, chữ ký số, xử lý hóa đơn đầu vào,… đầy đủ các ứng dụng mà kết toán cần. Tất cả hệ sinh thái này giúp doanh nghiệp và kế toán tích hợp và kết nối tốt nhất.\nVới phần mềm xử lý hóa đơn MISA meinvoice toàn bộ hóa đơn đầu vào đầu ra sẽ được tự động lấy về chương trinh sau đó tự động đồng bộ và hạch toán vào phần mềm kế toán, giúp tiết kiệm thời gian nhập liệu thủ công và giảm thiểu sai sót, đồng thời giúp kế toán quản lý tập trung hóa đơn đầu vào đầu ra trên cùng một hệ thống. Kế toán chỉ cần thiết lập email nhận hóa đơn, sau đó cung cấp email để người bán gửi trực tiếp hóa đơn qua email này, chương trình sẽ tự kiểm tra từng email nhận được và tải về tất cả các hóa đơn theo nội dung email. Với hóa đơn đầu vào nghị định 51, chương trình sẽ tự động kiểm tra và trả về kết quả tính hợp lệ của thông tin viết trên hóa đơn, tính hợp lệ của chữ ký số. Đặc biệt kiểm tra trạng thái thông báo phát hành hóa đơn, trạng thái doanh nghiệp dựa trên dữ liệu của tổng cục thuế, đảm bảo tính hợp pháp, hợp lệ của hóa đơn. Đối với hóa đơn thuộc vào nghị định 123, chỉ cần kết nối chương trình với hệ thống tra cứu của Tổng cục thuế, chương trình sẽ tự động lấy tất cả các hóa đơn về và kiểm tra các thông tin như: hóa đơn dã tồn tại trên trang của tổng cục thuế hay chưa, hóa đơn đã được cấp mã hay chưa, kiểm tra và tính toán số liệu trên hóa đơn.Đối với hóa đơn đầu ra, sau khi hóa đơn được chuyển vào phần mềm, tại danh sách hóa đơn đầu ra có thể dễ dàng nắm được tổng số lượng hóa đơn, tổng giá trị hóa đơn, tổng thuế GTGT đầu ra. Cụ thể là đối với hóa đơn đầu ra nghị định 123, chỉ cần kết nối phần mềm với Cổng tra cứu hóa đơn của Tổng cục thuế, chương trình sẽ tự động lấy toàn bộ hóa đơn đầu ra về vào lúc 0h hàng ngày. Đối với hóa đơn đầu ra nghị định 51, kế toán sẽ thực hiện tải hóa đơn vào phần mềm. Ngoài ra có thể tải các hóa đơn đầu vào, đầu ra đang quản lý trước đó vào chương trình để quản lý tập trung trên một hệ thống duy nhất, giúp kế toán dễ dàng tìm kiếm hóa đơn. Nếu doanh nghiệp đang sử dụng phần mềm kế toán SME.net thì toàn bộ hóa đơn đầu vào, đầu ra trên chương trình sẽ được tự động đồng bộ và hạch toán trên phần mềm, giúp kế toán tiết kiệm thời gian nhập liệu thủ công mỗi khi phát sinh hóa đơn. Đơn vị có nhiều chi nhánh hoạt động hoặc kế toán dịch vụ làm kế toán cho nhiều dn có thể dễ dàng quản lý hóa đơn theo nhiều khu vực, đối tượng.\nXem thêm tại đây: https://www.youtube.com/embed/B3AN9mBqDbM.

MISA meInvoice Web - Đăng ký sử dụng$Lập tờ khai đăng ký sử dụng hóa đơn điện tử không có mã của CQT$Sau khi Thiết lập thông tin đơn vị và Thiết lập ký số, thực hiện như sau:\n\nBước 1: Tại màn hình bắt đầu sử dụng, tích chọn Hóa đơn không có mã của CQT, nhấn Hoàn thiện tờ khai.\nhttps://helpv4.meinvoice.vn/wp-content/uploads/2019/12/r48_web_hoan_thien_to_khai_06-768x501.jpg\n\n\nBước 2: Chương trình đã tạo sẵn 1 tờ khai trên danh sách, nhấn biểu tượng Xem để xem chi tiết và hoàn thiện tờ khai.\n\nKhai báo thông tin liên hệ với CQT:\nVới tờ khai Đăng ký mới: Sau khi tờ khai được chấp nhận, cơ quan thuế sẽ gửi thông tin tài khoản truy cập hệ thống HĐĐT của Tổng cục Thuế và các thông báo quan trọng liên quan đến hóa đơn điện tử tới email/số điện thoại/địa chỉ này.\nVới tờ khai Thay đổi thông tin: Sau khi tờ khai được chấp nhận, cơ quan thuế sẽ gửi các thông báo quan trọng liên quan đến hóa đơn điện tử tới email/số điện thoại/địa chỉ này.\nhttps://helpv4.meinvoice.vn/wp-content/uploads/2019/12/r48_web_hoan_thien_to_khai_07-768x495.jpg\n\n1. Hình thức hóa đơn: Không có mã của cơ quan thuế (Phần mềm tự động lấy lên theo thiết lập hình thức hóa đơn tại Hồ sơ điện tử). Trường hợp đơn vị sử dụng song song 2 hình thức hóa đơn thì tích chọn cả 2 hình thức.\n2. Hình thức gửi dữ liệu hóa đơn điện tử: Để trống toàn bộ ( nếu đơn vị không thuộc trường hợp không phải trả tiền dịch vụ theo khoản 1, điều 14, nghị định 123/2020/NĐ-CP.)\n3. Phương thức chuyển hóa đơn điện tử: Chọn 1 trong 2 phương thức:\nChuyển đầy đủ nội dung từng hóa đơn: Chương trình sẽ tự động chuyển dữ liệu hóa đơn đến cơ quan thuế ngay sau khi hóa đơn được phát hành và gửi cho khách hàng.\nChuyển theo bảng tổng hợp dữ liệu hóa đơn: Kế toán lập bảng tổng hợp dữ liệu hóa đơn gửi cơ quan thuế định kỳ theo kỳ kê khai thuế GTGT tại đơn vị.\nXem hướng dẫn chi tiết cách chọn phương thức chuyển dữ liệu hóa đơn đến cơ quan thuế.\n4. Loại hóa đơn sử dụng: Tích chọn vào 1 hoặc nhiều loại hóa đơn theo thực tế sử dụng của từng đơn vị. Bao gồm:\n- Hóa đơn bán hàng\n- Hóa đơn GTGT\n- Hóa đơn GTGT khởi tạo từ máy tính tiền\n- Hóa đơn bán hàng khởi tạo từ máy tính tiền\n- Các loại hóa đơn khác: Vé điện tử\n- Chứng từ khác: Các loại phiếu xuất kho kiêm vận chuyển nội bộ, phiếu xuất kho hàng gửi bán đại lý.\n5. Danh sách chứng thư số sử dụng: Nhấn Chọn để lấy lên chứng thư số đơn vị sử dụng.\nNhấn Ký điện tử.\nhttps://helpv4.meinvoice.vn/wp-content/uploads/2019/12/r48_web_hoan_thien_to_khai_08.jpg\nNhấn Gửi để gửi tờ khai đến cơ quan thuế.\n\n\nBước 3: Theo dõi kết quả đăng ký.\n\nCơ quan thuế sẽ phản hồi về việc chấp nhận/không chấp nhận đăng ký sử dụng hóa đơn đơn điện tử trong 01 ngày kể từ ngày nộp tờ khai.\nTheo dõi kết quả đăng ký tại mục Đăng ký/Thay đổi thông tin.\nhttps://helpv4.meinvoice.vn/wp-content/uploads/2019/12/r48_web_hoan_thien_to_khai_09-768x96.jpg\n
MISA meInvoice Web - Đăng ký sử dụng$Đăng ký sử dụng hóa đơn với cơ quan thuế (HĐĐT có mã CQT)$Sau khi Thiết lập thông tin đơn vị và Thiết lập ký số, cần lập tờ khai đăng ký sử dụng hóa đơn điện tử với cơ quan thuế và khởi tạo mẫu hóa đơn quản lý tại đơn vị (không phải nộp cơ quan thuế).\n\nBước 1: Tích chọn hình thức hóa đơn là Hóa đơn có mã của CQT trước khi thực hiện đăng ký sử dụng và Nhấn Hoàn thiện tờ khai.\nhttps://helpv4.meinvoice.vn/wp-content/uploads/2021/10/r48_web_hoan_thien_to_khai_01-768x501.jpg\n\n\nBước 2: Chương trình đã tạo sẵn 1 tờ khai trên danh sách, nhấn biểu tượng Xem để xem chi tiết và hoàn thiện tờ khai.\nKhai báo thông tin liên hệ với CQT\na. Với tờ khai Đăng ký mới: Sau khi tờ khai được chấp nhận, cơ quan thuế sẽ gửi thông tin tài khoản truy cập hệ thống HĐĐT của Tổng cục Thuế và các thông báo quan trọng liên quan đến hóa đơn điện tử tới email/số điện thoại/địa chỉ này.\nb. Với tờ khai Thay đổi thông tin: Sau khi tờ khai được chấp nhận, cơ quan thuế sẽ gửi các thông báo quan trọng liên quan đến hóa đơn điện tử tới email/số điện thoại/địa chỉ này.\nhttps://helpv4.meinvoice.vn/wp-content/uploads/2021/10/r48_web_hoan_thien_to_khai_02-768x496.jpg\n\n1. Hình thức hóa đơn: Có mã của cơ quan thuế (Phần mềm tự động lấy lên theo thiết lập hình thức hóa đơn tại Hồ sơ điện tử). Trường hợp đơn vị sử dụng song song 2 hình thức hóa đơn thì tích chọn cả 2 hình thức.\n2. Hình thức gửi dữ liệu hóa đơn điện tử: Để trống toàn bộ (nếu đơn vị không thuộc trường hợp không phải trả tiền dịch vụ theo khoản 1, điều 14, nghị định 123/2020/NĐ-CP)\n3. Phương thức chuyển hóa đơn điện tử: Chọn Chuyển đầy đủ nội dung từng hóa đơn.\n4. Loại hóa đơn sử dụng: Tích chọn vào 1 hoặc nhiều loại hóa đơn theo thực tế sử dụng của từng đơn vị. Bao gồm:\n- Hóa đơn bán hàng\n- Hóa đơn GTGT\n- Hóa đơn GTGT khởi tạo từ máy tính tiền\n- Hóa đơn bán hàng khởi tạo từ máy tính tiền\n- Các loại hóa đơn khác: Vé điện tử\n- Chứng từ khác: Các loại phiếu xuất kho kiêm vận chuyển nội bộ, phiếu xuất kho hàng gửi bán đại lý.\n5. Danh sách chứng thư số sử dụng: Nhấn Chọn để lấy lên chứng thư số đơn vị sử dụng.\nNhấn Ký điện tử.\nhttps://helpv4.meinvoice.vn/wp-content/uploads/2021/10/r48_web_hoan_thien_to_khai_03.jpg\nNhấn Lưu và Gửi cơ quan thuế.\nhttps://helpv4.meinvoice.vn/wp-content/uploads/2021/10/r48_web_hoan_thien_to_khai_04-768x948.jpg\n\n\nBước 3: Cơ quan thuế chấp nhận tờ khai đăng ký và gửi phản hồi. Phần mềm sẽ thông báo và tự động cập nhật trạng thái CQT chấp nhận trên danh sách tờ khai cho người dùng được biết.\n
MISA meInvoice Web - Khởi tạo mẫu hóa đơn$Khởi tạo mẫu hóa đơn có mã$Video hướng dẫn\n[www.youtube.com/embed/0qnLSimimCA]\nBước 1: Chọn mẫu hóa đơn\nVào mục Đăng ký phát hành, chọn Mẫu hóa đơn cần khởi tạo.\nhttps://helpv4.meinvoice.vn/wp-content/uploads/2021/10/ktm_hoa-don_khong_ma_01.gif\n\n\nBước 2: Khai báo các thông tin cần thiết để khởi tạo mẫu hóa đơn.\n1. Chọn Hình thức hóa đơn là HĐ có mã của CQT.\n\n2. Chương trình tự động điền thông tin mẫu số và 4 ký tự đầu của mẫu hóa đơn:\n- Số 1: Phản ánh loại hóa đơn điện tử giá trị gia tăng.\n- C thể hiện hóa đơn điện tử có mã.\n- Hai ký tự tiếp theo là hai (02) chữ số Ả rập thể hiện năm lập hóa đơn điện tử được xác định theo 2 chữ số cuối của năm dương lịch.\n- Một ký tự tiếp theo là một (01) chữ cái được quy định là T, D, L, M, N, B, G, H thể hiện loại hóa đơn điện tử được sử dụng, cụ thể:  Chữ T: Áp dụng đối với hóa đơn điện tử do các doanh nghiệp, tổ chức, hộ, cá nhân kinh doanh đăng ký sử dụng với cơ quan thuế.\n- Hai ký tự cuối là chữ viết do người bán tự xác định căn cứ theo nhu cầu quản lý. Trường hợp người bán sử dụng nhiều mẫu hóa đơn điện tử trong cùng một loại hóa đơn thì sử dụng hai ký tự cuối nêu trên để phân biệt các mẫu hóa đơn khác nhau trong cùng một loại hóa đơn. Trường hợp không có nhu cầu quản lý thì để là YY.\n\n3. Phương thức chuyển dữ liệu hóa đơn: Đối với hóa đơn có mã, chương trình mặc định phương thức Chuyển đầy đủ nội dung từng hóa đơn.\nhttps://helpv4.meinvoice.vn/wp-content/uploads/2021/10/r47_web_ktm_hoa_don_co_ma.jpg\n\n4. Có thể thiết kế logo, hình nền hiển thị trên mẫu hóa đơn (nếu không có nhu cầu nhấn Bỏ qua)\nhttps://helpv4.meinvoice.vn/wp-content/uploads/2021/10/ktm_hoa_don_ko_ma_02.gif\n\n5. Có thể xem mẫu hóa đơn dạng chuyển đối, mẫu hóa đơn phát sinh chiết khấu, dạng, mẫu hóa đơn phát sinh ngoại tệ.\nhttps://helpv4.meinvoice.vn/wp-content/uploads/2021/10/ktm_co_ma_04.gif\n\n6. Có thể thiết lập lại cách hiển thị các thông tin trên hóa đơn\nhttps://helpv4.meinvoice.vn/wp-content/uploads/2021/10/ktm_co_ma_05.gif\n\n\nBước 3: Nhấn Lưu để hoàn thành việc khởi tạo mẫu hóa đơn điện tử.\n
MISA meInvoice Web - Khởi tạo mẫu hóa đơn$Khởi tạo mẫu hóa đơn không có mã của cơ quan thuế$Bước 1: Vào mục Đăng ký phát hành, chọn mẫu hóa đơn cần khởi tạo.\nhttps://helpv4.meinvoice.vn/wp-content/uploads/2021/11/KTM_HD_KHong_Ma_01-1.gif\n\n\nBước 2: Khai báo các thông tin cần thiết để khởi tạo mẫu hóa đơn.\n1. Chọn Hình thức hóa đơn là HĐ không có mã của CQT.\n\n2. Chương trình tự động điền thông tin mẫu số và 4 ký tự đầu của mẫu hóa đơn:\n- Số 1: Phản ánh loại hóa đơn điện tử giá trị gia tăng.\n- K thể hiện hóa đơn điện tử không có mã.\n- Hai ký tự tiếp theo là hai (02) chữ số Ả rập thể hiện năm lập hóa đơn điện tử được xác định theo 2 chữ số cuối của năm dương lịch.\n- Một ký tự tiếp theo là một (01) chữ cái được quy định là T, D, L, M, N, B, G, H thể hiện loại hóa đơn điện tử được sử dụng, cụ thể:  Chữ T: Áp dụng đối với hóa đơn điện tử do các doanh nghiệp, tổ chức, hộ, cá nhân kinh doanh đăng ký sử dụng với cơ quan thuế.\n- Hai ký tự cuối là chữ viết do người bán tự xác định căn cứ theo nhu cầu quản lý. Trường hợp người bán sử dụng nhiều mẫu hóa đơn điện tử trong cùng một loại hóa đơn thì sử dụng hai ký tự cuối nêu trên để phân biệt các mẫu hóa đơn khác nhau trong cùng một loại hóa đơn. Trường hợp không có nhu cầu quản lý thì để là YY.\nhttps://helpv4.meinvoice.vn/wp-content/uploads/2021/11/r47_web_ktm_hoa_don_ko_co_ma_01.jpg\n\n\nBước 3: Chọn phương thức chuyển dữ liệu hóa đơn điện tử đến CQT.\n1. Nếu chọn phương thức chuyển đầy đủ nội dung từng hóa đơn đến cơ quan thuế thì ngay sau khi hóa đơn được gửi cho khách hàng, chương trình sẽ tự động chuyển dữ liệu hóa đơn điện tử đến cơ quan thuế.\n\n2. Nếu chọn phương thức chuyển dữ liệu hóa đơn theo bảng tổng hợp dữ liệu hóa đơn điện tử thì định kỳ theo kỳ kê khai thuế GTGT đơn vị đang áp dụng (theo tháng/quý) kế toán lập bảng tổng hợp dữ liệu hóa đơn gửi cơ quan thuế.\nhttps://helpv4.meinvoice.vn/wp-content/uploads/2021/11/r47_web_ktm_hoa_don_ko_co_ma_02.jpg\n\n3. Có thể thiết kế logo, hình nền hiển thị trên mẫu hóa đơn (nếu không có nhu cầu nhấn Bỏ qua)\nhttps://helpv4.meinvoice.vn/wp-content/uploads/2021/11/KTM_Hd_ko_ma_05.gif\n\n4. Có thể xem mẫu hóa đơn dạng chuyển đối, mẫu hóa đơn phát sinh chiết khấu, dạng, mẫu hóa đơn phát sinh ngoại tệ.\nhttps://helpv4.meinvoice.vn/wp-content/uploads/2021/11/ktm_hd_ko_ma_06.gif\n\n5. Có thể thiết lập lại cách hiển thị các thông tin trên hóa đơn.\nhttps://helpv4.meinvoice.vn/wp-content/uploads/2021/11/ktm_hd_ko_ma_07.gif\n\n\nBước 4: Nhấn Lưu để hoàn thành việc khởi tạo mẫu hóa đơn điện tử.\n
MISA meInvoice Web - Khởi tạo mẫu hóa đơn$Chuyển mẫu hóa đơn theo nghị định 51/2010/NĐ-CP sang mẫu hóa đơn có mã theo nghị định 123/2020/NĐ-CP$Bước 1: Tại danh sách mẫu hóa đơn, nhấn chọn Chuyển từ mẫu cũ theo NĐ51.\nhttps://helpv4.meinvoice.vn/wp-content/uploads/2021/12/chuyen_doi_sang-mau_hoa_don_co_ma_01-1.png\n\n\nBước 2: Chương trình hiển thị danh sách mẫu hóa đơn theo nghị định 51/2010/NĐ-CP, tại mẫu hóa đơn cần chuyển đổi sang nghị định 123/2020/NĐ-CP, nhấn Chuyển đổi.\nhttps://helpv4.meinvoice.vn/wp-content/uploads/2021/12/chuyen_doi_sang-mau_hoa_don_co_ma_02-1-768x384.png\nLưu ý:\n- Có thể xem lại mẫu hóa đơn trước khi chuyển đổi bằng cách nhấn Xem.\n- Với mẫu hóa đơn khởi tạo từ phần mầm mềm MIMOSA và mẫu hóa đơn khởi tạo trước ngày 06/10/2020 thì không thể chuyển đổi lên mẫu hóa đơn theo nghị định 123/2020/NĐ-CP (chương trình sẽ hiển thị trạng thái Không thể chuyển đổi)\n- Hiện tại, danh sách mẫu hóa đơn theo nghị định 51/2010/NĐ-CP vẫn lấy lên cả những mẫu đã được chuyển đổi.\n\n\nBước 3: Chuyển đổi mẫu hóa đơn theo nghị định 123/2020/NĐ-CP.\n1. Chọn hình thức hóa đơn đơn vị sử dụng.\n\n2. Khai báo thông tin mẫu hóa đơn mới. Xem hướng dẫn đặt mẫu số, ký hiệu hóa đơn theo nghị định 123/2020/NĐ-CP tại [https://helpv4.meinvoice.vn/kb/mau-so-ky-hieu-hoa-don-dien-tu-theo-quy-dinh-tai-nghi-dinh-123-2020-nd-cp-khac-gi-so-voi-quy-dinh-cu/].\nhttps://helpv4.meinvoice.vn/wp-content/uploads/2021/12/R47_web_chuyen-doi_mau_hd_01-768x451.jpg\n\n3. Phương thức chuyển nội dung hóa đơn đến CQT:\n- Nếu chọn HĐ có mã của CQT: Chương trình mặc định tích chọn phương thức chuyển đầy đủ nội dung từng hóa đơn.\n- Nếu chọn HĐ không có mã của CQT: Xem hướng dẫn cách chọn phương thức chuyển dữ liệu hóa đơn đến cơ quan thuế tại [https://helpv3.meinvoice.vn/kb/chon-phuong-thuc-chuyen-du-lieu-hoa-don-dien-tu-den-cqt/].\nhttps://helpv4.meinvoice.vn/wp-content/uploads/2021/12/R47_web_chuyen-doi_mau_hd_02-768x451.jpg\n\n4. Có thể xem trước mẫu hóa đơn chuyển đổi bằng cách nhấn Xem trước thay đổi.\nhttps://helpv4.meinvoice.vn/wp-content/uploads/2021/12/R47_web_chuyen-doi_mau_hd_03-768x412.jpg\n\n\nBước 4: Nhấn Đồng ý, chương trình thông báo chuyển đổi mẫu thành công.\nhttps://helpv4.meinvoice.vn/wp-content/uploads/2021/12/chuyen_doi_sang-mau_hoa_don_co_ma_05-1.png\n\n\nBước 5: Nhấn Đóng, trên danh sách mẫu hóa đơn hiển thị mẫu hóa đơn chuyển đổi.\nhttps://helpv4.meinvoice.vn/wp-content/uploads/2021/12/chuyen_doi_sang-mau_hoa_don_co_ma_06-1-768x146.png\n
MISA meInvoice Web - Phân quyền sử dụng hóa đơn$Phân quyền sử dụng hóa đơn$Bước 1: Truy cập và đăng nhập vào Webside: [http://meInvoice.vn].\nhttps://helpv4.meinvoice.vn/wp-content/uploads/2019/12/web_dangnhap_01.png\n\n\nBước 2: Vào mục Hệ thống\\ chọn Quản lý người dùng\\ nhấn Thêm mới người dùng.\nhttps://helpv4.meinvoice.vn/wp-content/uploads/2019/12/phan_quyen_nguoi_dung_01-1.png\n\n\nBước 3: Khai báo thông tin người dùng\n1. Phân Quyền truy cập cho người dùng:\na. Quyền Quản trị: Được thực hiện tất cả chức năng trên phần mềm.\nb. Quyền Người dùng: Không có quyền phân quyền (không nhìn thấy mục Người sử dụng) và không có quyền Xác nhận thỏa thuận sử dụng dịch vụ.\nhttps://helpv4.meinvoice.vn/wp-content/uploads/2019/12/phan_quyen_nguoi_dung_02.png\n\n2. Phân quyền chức năng cho người dùng.\n- Chọn tab Phân quyền chức năng.\n- Chọn chức năng trên màn hình danh sách chức năng.\n- Tích chọn các hoạt động cho phép người dùng sử dụng tương ứng với chức năng đó.\nhttps://helpv4.meinvoice.vn/wp-content/uploads/2019/12/phan_quyen_nguoi_dung_03.png\n\n3. Phân quyền mẫu hóa đơn cho người dùng (Đối với vai trò Người dùng)\n- Chọn tab Phân quyền mẫu hóa đơn.\n- Tích chọn mẫu hóa đơn cho phép người dùng sử dụng.\nhttps://helpv4.meinvoice.vn/wp-content/uploads/2019/12/phan_quyen_nguoi_dung_05.png\nLưu ý: Người dùng được phân quyền làm việc với mẫu hóa đơn tạo năm 2021 (ví dụ mẫu 2C21TYT) thì sang năm mới (năm 2022), chương trình tự động chuyển sang mẫu 2C22TYT và người dùng vẫn có quyền làm việc với mẫu hóa đơn đó.\n\n4. Phân quyền theo đơn vị: Dành cho đơn vị quản lý hóa đơn theo khu vực xuất.\n\n\nBước 4: Nhấn Lưu hoặc Lưu và Thêm.\n\n\nBước 5: Sau khi được phân quyền, người dùng sẽ nhận được 1 email thông báo cấp quyền sử dụng meInvoice.\n\n\nBước 6: Người dùng đăng nhập meInvoice Web để kích hoạt tài khoản.\nNhấn Đăng nhập ngay.\n[https://helpv4.meinvoice.vn/wp-content/uploads/2019/12/r18_desktop_dang_nhap_sau_khi_duoc_phan-quyen1-768x388.png\n
MISA meInvoice Web - Thiết lập Email gửi hóa đơn$Thiết lập Email gửi hóa đơn$Bước 1: Vào mục Hệ thống\\ chọn Emai gửi hóa đơn.\nhttps://helpv4.meinvoice.vn/wp-content/uploads/2020/01/thiet_lap_email_gui_hd_01.jpg\n\n\nBước 2: Chọn Nhà cung cấp dịch vụ Email.\n1. Dịch vụ email \nMISA\nChương trình sẽ dùng dịch vụ email của \nMISA để gửi hóa đơn cho người mua, khách hàng không cần thiết lập máy chủ gửi email.\nhttps://helpv4.meinvoice.vn/wp-content/uploads/2020/01/mail_reply.png\n\n2. Một trong những nhà cung cấp: Gmail\n2.1. Đăng nhập tài khoản Google. Tại phần Chọn ứng dụng chọn Khác (Tên tùy chỉnh).\nhttps://helpv4.meinvoice.vn/wp-content/uploads/2019/12/thiet_lap_cai_dat_gmail_0014.png\n2.2. Nhập tên ứng dụng muốn tạo mật khẩu (đặt tên bất kỳ Ví dụ: meinvoice, HDDT…), nhấn Tạo\nhttps://helpv4.meinvoice.vn/wp-content/uploads/2019/12/thiet_lap_cai_dat_gmail_0015.png\n2.3. Lúc này, gmail đã tạo mật khẩu để thiết lập email gửi hóa đơn điện tử trên \nMISA MEINVOICE, \nMISA SME.NET, anh/chị lưu lại thông tin mật khẩu này. Nhấn Xong.\nhttps://helpv4.meinvoice.vn/wp-content/uploads/2019/12/thiet_lap_cai_dat_gmail_0016.png\n2.4. Thiết lập thông tin máy chủ gửi mail trên meInvoice.\nhttps://helpv4.meinvoice.vn/wp-content/uploads/2020/01/r20_Web_ch%E1%BB%8Dn_ban_lam_viec03.png\n- Tên người gửi/Email gửi: các thông tin này sẽ được sử dụng để người nhận email biết được thông tin người gửi (trên email sẽ hiển thị thông tin “From: Tên người gửi/Email gửi” khai báo tại đây. Ví dụ: From: Công ty TNHH XYZ.)\n- Tên đăng nhập và Mật khẩu: Là tài khoản đăng nhập vào gmail của người gửi.\n- Nhấn Kiểm tra thiết lập để xem thông tin về cấu hình email có đúng hay không => Nếu chưa đúng thì thực hiện thiết lập lại.\n- Nhấn Lưu. Khi gửi hóa đơn cho khách hàng, chương trình sẽ thực hiện gửi từ email đã thiết lập, với tiêu đề email chứa tên công ty được khai báo ở trên.\n\n3. Nếu chọn một trong các nhà cung cấp: Hotmail; Outlook Mail; Yahoo Mail\n- Chọn nhà cung cấp.\nhttps://helpv4.meinvoice.vn/wp-content/uploads/2020/01/thiet_lap_email_gui_hd_02.jpg\n- Tên người gửi/Email gửi: các thông tin này sẽ được sử dụng để người nhận email biết được thông tin người gửi (trên email sẽ hiển thị thông tin “From: Tên người gửi/Email gửi” khai báo tại đây. Ví dụ: From: Công ty TNHH XYZ.)\n- Tên đăng nhập và Mật khẩu: Là tài khoản đăng nhập vào email của người gửi (Ví dụ: Tài khoản Yahoo…)\n
