MISA meInvoice Web - Khai báo danh mục$Khai báo danh mục khách hàng$Bước 1: Vào Danh mục, chọn Khách hàng.\nBước 2: Nhấn Thêm mới.\nBước 3: Khai báo thông tin khách hàng:\nhttps://helpv3.meinvoice.vn/wp-content/uploads/2019/12/nhap_khau_khach_hang_02.png\n1. Lựa chọn khách hàng cần khai báo là Tổ chức hoặc Cá nhân.\n2. Nhập Mã số thuế của khách hàng sau đó nhấn Lấy thông tin, chương trình tự động lấy lên Tên khách hàng và Địa chỉ theo dữ liệu của cơ quan thuế (hoặc có thể tự khai báo các thông tin này nếu muốn).\n3. Với tổ chức không có Mã số thuế thì bỏ trống thông tin này.\nLưu ý: Khi thực hiện chức năng Lấy thông tin từ Mã số thuế của khách hàng thì chương trình tự động kiểm tra tình trạng hoạt động của khách hàng đó.\n4. Khai báo các thông tin chi tiết khác về khách hàng => Bắt buộc phải khai báo các thông tin có ký hiệu (*).\nhttps://helpv3.meinvoice.vn/wp-content/uploads/2019/12/danh_muc_khach_hang.png\n\nBước 4: Nhấn Lưu.\nLưu ý: Với các khách hàng không còn giao dịch nữa, nhấn Sửa và tích chọn Ngừng theo dõi => Khi lập hóa đơn điện tử, các khách hàng đã ngừng theo dõi sẽ không hiển thị tại mục Khách hàng nữa.\nhttps://helpv3.meinvoice.vn/wp-content/uploads/2019/12/danh_muc_khach_hang02.png\n\n
MISA meInvoice Web - Khai báo danh mục$Khai báo danh mục hàng hóa, dịch vụ$Bước 1: Vào Danh mục, chọn Hàng hóa, dịch vụ.\nBước 2: Nhấn Thêm mới.\nBước 3: Khai báo thông tin hàng hóa, dịch vụ.\nhttps://helpv4.meinvoice.vn/wp-content/uploads/2019/12/R30_web_them_HH_01.png\nLưu ý:\n1. Bắt buộc phải khai báo các thông tin có ký hiệu (*).\n2. Mục Nhóm HHDV, nếu khai báo:\n- Trên Báo cáo thống kê số lượng hóa đơn đã phát hành sẽ thống kê được giá trị hóa đơn đã phát hành theo từng nhóm hàng hóa , dịch vụ phục vụ nhu cầu quản lý của đơn vị.\n- Để khai báo thông tin hàng hóa, dịch vụ theo nhóm cần thiết lập danh mục Nhóm hàng hóa, dịch vụ.\n- Thuế GTGT (%): Nhập mức thuế suất tương ứng của hàng hóa, dịch vụ trong đó:\n+ Mức KCT: dành cho hàng hóa, dịch vụ không chịu thuế.\n+ Mức KKKNT: Thuế suất trống và tiền thuế bằng 0.\n+ Mức KHAC: Thuế suất trống và tiền thuế >0 (thường sử dụng trong lĩnh vực Hàng Hải)\nhttps://helpv4.meinvoice.vn/wp-content/uploads/2019/12/R30_web_them_HH_02.png\n\n\nBước 4: Nhấn Lưu.\nLưu ý: Với các Hàng hóa, dịch vụ không còn kinh doanh nữa tích chọn Ngừng theo dõi\n
MISA meInvoice Web - Khai báo danh mục$Khai báo danh mục loại tiền$Bước 1: Vào Danh mục, chọn Loại tiền.\nBước 2: Chọn loại tiền muốn sửa đổi thông tin, nhấn biểu tượng\nhttps://helpv4.meinvoice.vn/wp-content/uploads/2020/04/r22_icon.png\n(hoặc nhấn Thêm mới để bổ sung loại tiền mới).\nBước 3: Khai báo thông tin chi tiết về loại tiền:\n1. Bắt buộc phải khai báo các thông tin có ký hiệu (*).\n2. Nhập Tỷ giá quy đổi: Khi xuất hóa đơn bằng ngoại tệ chương trình sẽ ngầm định theo tỷ giá này, giúp tiết kiệm thời gian nhập liệu.\n3. Thiết lập Cách đọc số tiền bằng chữ để hiển thị trên các hóa đơn in ra:\n- Tỷ lệ chuyển đổi: Là tỷ lệ chuyển đổi giữa loại tiền và số tiền sau thập phân (Ví dụ: 1 đô la mỹ = 100 xen)\n- Sau khi thiết lập xong cách đọc số tiền bằng chữ: nhập số tiền rồi nhấn Đọc để xem trước cách hiển thị số tiền trên hóa đơn in ra.\nhttps://helpv4.meinvoice.vn/wp-content/uploads/2020/04/r22_Web_loai_tien02.png\n\n\nBước 4: Nhấn Lưu.\nLưu ý: Với các loại tiền không có nhu cầu theo dõi nữa, sử dụng chức năng Sửa, sau đó tích chọn Ngừng theo dõi => Khi lập hóa đơn điện tử bằng ngoại tệ, các Loại tiền đã ngừng theo dõi sẽ không hiển thị tại mục Loại tiền nữa.\n
MISA meInvoice Web - Khai báo danh mục$Quản lý hóa đơn theo đơn vị xuất$Bước 1: Khai báo danh mục đơn vị\nhttps://helpv4.meinvoice.vn/wp-content/uploads/2021/05/R35_Web_quan_ly_hoa_don_theo_don_vi_01.png\nLưu ý:\n1. Chương trình tự động sinh đơn vị cấp 1 theo thông tin khai báo khi đặt mua hóa đơn điện tử, có thể sửa lại (nếu cần) nhưng không được phép xóa.\n2. Chương trình đáp ứng khai báo đến đơn vị cấp 3.\nhttps://helpv4.meinvoice.vn/wp-content/uploads/2021/05/R35_Web_quan_ly_hoa_don_theo_don_vi_02.png\n3. Sau khi khai báo danh mục Đơn vị xuất hóa đơn, trên giao diện lập hóa đơn hiển thị mục Đơn vị lập hóa đơn và danh sách đơn vị đã khai báo.\nhttps://helpv4.meinvoice.vn/wp-content/uploads/2021/05/R35_Web_quan_ly_hoa_don_theo_don_vi_10.png\n4. Có thể thiết lập Ngừng sử dụng đối với đơn vị không còn nhu cầu quản lý khi đó danh sách đơn vị trên giao diện lập hóa đơn sẽ không hiển thị đơn vị Ngừng sử dụng.\nhttps://helpv4.meinvoice.vn/wp-content/uploads/2021/05/R35_Web_quan_ly_hoa_don_theo_don_vi_09.png\n\n\nBước 2: Phân quyền người dùng theo đơn vị\n1. Phân quyền người dùng theo đơn vị ngay trên thông báo sau khi khai báo đơn vị.\n- Nhấn Có trên thông báo.\n- Tích chọn người dùng muốn phân quyền làm việc trên đơn vị, nhấn Đồng ý.\nhttps://helpv4.meinvoice.vn/wp-content/uploads/2021/05/r35_PHAN_QUYEN_NG_DUNG010.png\n2. Hoặc vào Hệ thống\\Quản lý người dùng để thực hiện: Các bước phân quyền người dùng theo đơn vị xuất hóa đơn tương tự như phân quyền người dùng thông thường.\n- Tại mục Đơn vị: Chọn đơn vị mà người dùng trực thuộc.\n- Tại tab Phân quyền theo đơn vị: Người dùng trực thuộc đơn vị nào thì được phép làm việc trên đơn vị đó, ngoài ra có thể phân quyền cho người dùng làm việc trên các đơn vị khác.\nhttps://helpv4.meinvoice.vn/wp-content/uploads/2021/05/R35_Web_quan_ly_hoa_don_theo_don_vi_04.png\n\n\nBước 3: Lập và phát hành hóa đơn theo đơn vị.\n1. Tại mục Đơn vị lập hóa đơn, xuất hóa đơn tại đơn vị nào thì chọn đơn vị đó.\nhttps://helpv4.meinvoice.vn/wp-content/uploads/2021/05/R35_Web_quan_ly_hoa_don_theo_don_vi_06.png\n2. Lưu ý\n- Nếu người dùng chỉ được phân quyền làm việc trên 1 đơn vị thì trên giao diện lập hóa đơn sẽ không hiển thị thông tin Đơn vị lập hóa đơn, hóa đơn được lập sẽ thuộc đơn vị mà người dùng được phân quyền.\n- Nhập khẩu hóa đơn theo đơn vị.\n\n\nBước 4: Quản lý hóa đơn theo đơn vị\n1. Tra cứu, tìm kiếm hóa đơn theo đơn vị trên danh sách hóa đơn\n- Trên danh sách hóa đơn hiển thị cột Đơn vị.\nhttps://helpv4.meinvoice.vn/wp-content/uploads/2021/05/R35_Web_quan_ly_hoa_don_theo_don_vi_07.png\n- Có thể lọc xem danh sách hóa đơn của từng đơn vị.\nhttps://helpv4.meinvoice.vn/wp-content/uploads/2021/05/R35_Web_quan_ly_hoa_don_theo_don_vi_08.png\n\n2. Xem các báo cáo về tình hình sử dụng hóa đơn theo đơn vị\nhttps://player.vimeo.com/video/560694780\nLưu ý:\n- Cột Đơn vị và tham số lọc theo đơn vị chỉ tự động hiển thị trên danh sách hóa đơn, báo cáo nếu người dùng có quyền làm việc trên nhều đơn vị.\n- Nếu người dùng chỉ có quyền làm việc trên 1 đơn vị thì danh sách hóa đơn, báo cáo lấy lên dữ liệu của đơn vị mà người dùng có quyền, nếu muốn hiển thị cột Đơn vị trên danh sách/báo cáo thì người dùng phải tự thiết lập.\nhttps://helpv4.meinvoice.vn/wp-content/uploads/2021/05/R35_Web_quan_ly_hoa_don_theo_don_vi_11.png\n
MISA meInvoice Web - Nghiệp vụ hóa đơn$Lập hóa đơn (có mã)$Tại tab Hóa đơn bán hàng, nhấn Thêm mới\nhttps://helpv4.meinvoice.vn/wp-content/uploads/2021/10/lap-hd-1-768x392.png\n2. Điền đầy đủ các thông tin trên hóa đơn\nhttps://helpv4.meinvoice.vn/wp-content/uploads/2021/10/lap-hoa-don-4.gif\n
MISA meInvoice Web - Nghiệp vụ hóa đơn$Phát hành hóa đơn (có mã)$Kế toán có thể phát hành hóa đơn điện tử theo 1 trong 2 cách:\nI. Phát hành từng hóa đơn điện tử:\nCó thể thực hiện phát hành từng hóa đơn điện tử theo 1 trong 2 cách:\nCách 1: Phát hành hóa đơn điện tử trên danh sách Hóa đơn\n1. Vào danh sách hóa đơn, thiết lập điều kiện tìm kiếm hóa đơn cần phát hành.\nhttps://helpv4.meinvoice.vn/wp-content/uploads/2021/10/loc-hoa-don-768x392.png\n2. Tích chọn hóa đơn cần phát hành, nhấn Phát hành.\nhttps://helpv4.meinvoice.vn/wp-content/uploads/2021/10/loc-hoa-don_2-1-768x304.png\n3. Tích chọn Gửi hóa đơn cho khách hàng: Nếu muốn chương trình tự động gửi thông tin về hóa đơn điện tử cho khách hàng ngay sau khi nhận được mã của cơ quan thuế.\nhttps://helpv4.meinvoice.vn/wp-content/uploads/2021/10/phat-hanh-hd.png\n4. Nhấn Phát hành, lựa chọn chứng thư số, chương trình đồng thời cấp số hóa đơn và phát hành hóa đơn điện tử. Chọn chứng thư số của đơn vị\\ nhấn OK.\nhttps://helpv4.meinvoice.vn/wp-content/uploads/2019/12/R34_Web_phat_hanh_hoa_don_05-1-300x233.png\n5. Sau khi phát hành thành công, hóa đơn được gửi lên cơ quan thuế chờ cấp mã.\n- Trường hợp hóa đơn hợp lệ, cơ quan thuế thực hiện cấp mã và gửi về thông điệp kết quả cấp mã của cơ quan thuế, hệ thống đồng thời cập nhật Mã của cơ quan thuế trạng thái hóa đơn thành Đã cấp mã\nhttps://helpv4.meinvoice.vn/wp-content/uploads/2021/10/H1-768x365.png\n- Trường hợp hóa đơn không hợp lệ, cơ quan thuế thực hiện cấp mã và gửi về thông điệp kết quả kiểm tra dữ liệu hóa đơn điện tử – hóa đơn không đủ điều kiện cấp mã, hệ thống cập nhật trạng thái hóa đơn thành Từ chối cấp mã.\n\nCách 2: Phát hành hóa đơn điện tử ngay trên các hóa đơn đã lập.\n1. Sau khi lập hóa đơn điện tử, Nhấn Lưu và Phát hành.\nhttps://helpv4.meinvoice.vn/wp-content/uploads/2021/10/phat-hanh-cach-2-768x670.png\n2. Thực hiện các bước tiếp theo tương tự như cách 1.\n\n\nII. Phát hành hàng loạt hóa đơn điện tử.\n1. Tích chọn các hóa đơn muốn phát hành trên danh sách hóa đơn, nhấn Phát hành.\nhttps://helpv4.meinvoice.vn/wp-content/uploads/2021/10/phat-hanh-hang-loat-768x349.png\n\n2. Tích chọn Gửi HĐ nếu muốn chương trình tự động gửi hóa đơn điện tử cho khách hàng ngay sau khi thực hiện chức năng phát hành hóa đơn điện tử.\n- Tên người nhận và Email người nhận: Lấy theo thông tin Người mua hàng và Email trên hóa đơn, tuy nhiên vẫn có thể thay đổi lại các thông tin này (nếu cần).\n- Thông tin Mẫu số, Ký hiệu, Ngày hóa đơn được lấy theo thông tin trên hóa đơn. Số hóa đơn sẽ được cấp liên tục tương ứng với từng mẫu hóa đơn theo Thông báo phát hành hóa đơn đã có hiệu lực.\nhttps://helpv4.meinvoice.vn/wp-content/uploads/2021/10/nhan-gugi-768x408.png\n\n3. Nhấn Phát hành.\n\n4. Lựa chọn chứng thư số, chương trình sẽ thực hiện phát hành hóa đơn điện tử.\n
MISA meInvoice Web - Nghiệp vụ hóa đơn$Gửi hóa đơn điện tử cho khách hàng (có mã)$Cách 1: Gửi lần lượt từng hóa đơn\n1. Trên danh sách hóa đơn, tại dòng hóa đơn cần gửi. Nhấn chọn Gửi hóa đơn cho KH.\n2. Nhập thông tin người nhận và nhấn Gửi\nhttps://helpv4.meinvoice.vn/wp-content/uploads/2021/11/Xuat-tung-hd.gif\n\n\nCách 2: Gửi đồng loạt nhiều hóa đơn\n1. Tích chọn nhiều hóa đơn muốn gửi.\n2. Có thể thay đổi thông tin (tên, địa chỉ mail) của người nhận.\n3. Nhấn Gửi.\nhttps://helpv4.meinvoice.vn/wp-content/uploads/2021/11/gui-hd-hang-loat.gif\n
MISA meInvoice Web - Nghiệp vụ hóa đơn$Tra cứu lịch sử truyền nhận dữ liệu HĐĐT với cơ quan thuế (có mã)$1. Xem tại mục Lịch sử truyền nhận.\nhttps://helpv4.meinvoice.vn/wp-content/uploads/2021/11/tra-cuu-lich-su-truyen-nhan.gif\n\n2. Chi tiết thông điệp truyền nhận.\nhttps://helpv4.meinvoice.vn/wp-content/uploads/2021/11/thong-diep.png\n\n3. Có thể xem chi tiết tờ khai/thông báo sai sót bằng cách nhấn vào Số tờ khai/Số TB của NNT.\nhttps://helpv4.meinvoice.vn/wp-content/uploads/2021/11/xem_lich_su_truyen_nhan.gif\n\n4. Xem chi tiết nhật ký truyền nhận dữ liệu của tờ khai/hóa đơn/thông báo sai sót bằng cách nhấn đúp chuột vào dòng dữ liệu.\nhttps://helpv4.meinvoice.vn/wp-content/uploads/2021/11/xem_lich_su_truyen_nhan_02.gif\n
MISA meInvoice Web - Nghiệp vụ hóa đơn$Chuyển hóa đơn điện tử thành hóa đơn giấy (có mã)$I. Chuyển từng hóa đơn điện tử thành hóa đơn giấy\n1. Tại hóa đơn cần chuyển thành hóa đơn giấy trên danh sách hóa đơn, chọn Chuyển thành hóa đơn giấy.\nhttps://helpv4.meinvoice.vn/wp-content/uploads/2021/12/chuyen_hoa_don-co_ma_thanh_hoa_don_giay_01-1.gif\n2. Khai báo thông tin Người chuyển đổi, ngày chuyển đổi, nhấn Chuyển đổi.\nhttps://helpv4.meinvoice.vn/wp-content/uploads/2021/12/chuyenr_hoa_don_co_ma_thanh_Hoa_don_giay_02-1.png\n3. Trên hóa đơn hiển thị dấu hiệu nhận biết hóa đơn điện tử chuyển đổi thành hóa đơn giấy.\nhttps://helpv4.meinvoice.vn/wp-content/uploads/2021/12/chuyen_hoa_don_co_ma_thanh_Hoa_don_giay_03.png\n\nII. Chuyển hàng loạt hóa đơn điện tử thành hóa đơn giấy\n1. Tại danh sách hóa đơn, tích chọn hàng loạt hóa đơn cần chuyển thành hóa đơn giấy.\nhttps://helpv4.meinvoice.vn/wp-content/uploads/2021/12/chuyen_hoa_don_co_ma_thanh_hoa_don_giay_02.gif\n2. Khai báo thông tin Người chuyển đổi, ngày chuyển đổi, nhấn Chuyển đổi.\nhttps://helpv4.meinvoice.vn/wp-content/uploads/2021/12/chuyenr_hoa_don_co_ma_thanh_Hoa_don_giay_03.png\n3. Chương trình chuyển cùng lúc hàng loạt hóa đơn thành hóa đơn giấy.\n
MISA meInvoice Web - Nghiệp vụ hóa đơn$Xử lý hóa đơn có mã CQT sai sót$Trường hợp 1: Người bán tự phát hiện sai sót, hóa đơn chưa gửi cho khách hàng.\nBước 1: Hủy hóa đơn có mã sai sót\n[https://helpv4.meinvoice.vn/kb/huy-hoa-don-co-ma/#buoc-1-thuc-hien-huy-hoa-don-tren-phan-mem]\n\nBước 2: Lập và phát hành hóa đơn mới cho khách hàng\nhttps://helpv4.meinvoice.vn/kb/lap-hoa-don-co-ma/\nhttps://helpv4.meinvoice.vn/kb/phat-hanh-hoa-don-co-ma/\n\nBước 3: Lập thông báo HĐ sai sót gửi cơ quan thuế\n[https://helpv4.meinvoice.vn/kb/huy-hoa-don-co-ma/#buoc-2-thuc-hien-lap-thong-bao-sai-sot]\n\n\nTrường hợp 2: Người bán phát hiện hóa đơn sai sót sau khi gửi cho khách hàng, sai về Tên; Địa chỉ người mua, các thông tin khác không sai sót.\nBước 1: Gửi thông báo cho người mua về hóa đơn sai sót và không cần lập lại HĐ.\n[https://helpv4.meinvoice.vn/kb/dieu-chinh-thong-tin-hoa-don-co-ma/#buoc-1-gui-thong-bao-cho-nguoi-mua-ve-hoa-don-sai-sot]\n\nBước 2: Lập thông báo HĐ sai sót gửi cơ quan thuế\n[https://helpv4.meinvoice.vn/kb/thong-bao-hoa-don-sai-sot-ten-di%cc%a3a-chi%cc%89-khong-sai-thong-tin-khac-voi-cqt/#buoc-2-lap-thong-bao-hoa-don-dien-tu-sai-sot-gui-co-quan-thue]\n\n\nTrường hợp 3: Người bán tự phát hiện hóa đơn sai sót sau khi gửi cho khách hàng, sai về Mã số thuế; sai Số tiền ghi trên hóa đơn; sai Tiền thuế; Thuế suất; hoặc Hàng hóa ghi trên hóa đơn không đúng quy cách, chất lượng.\nNgười bán và người mua tự thỏa thuận với nhau để chọn 1 trong 2 cách giải quyết.\nCách 1: Lập hóa đơn điều chỉnh cho hóa đơn sai sót\nhttps://helpv4.meinvoice.vn/kb/lap-va-phat-hanh-hoa-don-dieu-chinh-hoa-don-co-ma/\n\nCách 2: Hủy hóa đơn sai sót và lập hóa đơn thay thế\nhttps://helpv4.meinvoice.vn/kb/xoa-hoa-don-va-lap-hoa-don-thay-the-hoa-don-co-ma/\n\n\nTrường hợp 4: Cơ quan thuế phát hiện sai sót và thông báo đến người bán.\nCơ quan thuế sẽ gửi thông báo rà soát trực tiếp qua email của người nộp thuế\nBước 1: Giải trình với cơ quan thuế về hóa đơn sai sót\n[https://helpv4.meinvoice.vn/kb/dieu-chinh-thong-tin-hoa-don-co-ma/#buoc-2-lap-thong-bao-hoa-don-dien-tu-sai-sot-gui-co-quan-thue]\n\nBước 2: Lập hóa đơn điều chỉnh hóa đơn sai sót hoặc Hủy hóa đơn sai sót và lập hóa đơn thay thế theo thỏa thuận với người mua.\nhttps://helpv4.meinvoice.vn/kb/lap-va-phat-hanh-hoa-don-dieu-chinh-hoa-don-co-ma/\nhttps://helpv4.meinvoice.vn/kb/xoa-hoa-don-va-lap-hoa-don-thay-the-hoa-don-co-ma/\n\n\n


MISA meInvoice Desktop - Cài đặt và kết nối dữ liệu$Cài đặt và kết nối dữ liệu$I. Đối với 1 người dùng phần mềm\nBước 1: Tải bộ cài tại https://product.\nmisa.vn/\nmisasoftware/eInvoice/Desktop123/\nMISAmeInvoice123_Setup_Client.exe\nBước 2: Thực hiện cài đặt.\n1. Click chuột vào biểu tượng phần mềm vừa tải về.\nhttps://helpv4.meinvoice.vn/wp-content/uploads/2019/12/tai_bo_cai_01-2.png\n\n2. Nhấn Tiếp tục.\nhttps://helpv4.meinvoice.vn/wp-content/uploads/2019/12/cai_dat_03.png\n\n3. Nhấn Cài đặt.\nhttps://helpv4.meinvoice.vn/wp-content/uploads/2019/12/cai_dat_04.png\n\n4. Nhấn Hoàn thành.\nhttps://helpv4.meinvoice.vn/wp-content/uploads/2019/12/cai_dat_05.png\n\n\nII. Đối với nhiều người dùng phần mềm\nMô tả: Áp dụng với đơn vị có nhiều người cùng sử dụng phần mềm để lập và phát hành hóa đơn. Khi đó, phần mềm sẽ được triển khai theo mô hình máy trạm – máy chủ (Client – Server). Trong đó, có 01 máy chủ chứa dữ liệu (SQL Server) chung cho cả hệ thống và nhiều máy trạm kết nối vào máy chủ để cùng làm việc và chia sẻ dữ liệu.\nhttps://helpv4.meinvoice.vn/wp-content/uploads/2019/12/R5_mohinh_01.png\nLưu ý:\n- Mô hình này phù hợp khi các máy tính làm việc trong cùng một mạng nội bộ (mạng LAN).\n- Có thể dùng một máy tính vừa đóng vai trò làm máy chủ chứa dữ liệu, vừa đóng vai trò làm máy trạm để làm việc.\nHướng dẫn cài đặt và kết nối dữ liệu:\n1. Máy chủ\nBước 1: Cài đặt bộ cài máy chủ tại https://product.\nmisa.vn/\nmisasoftware/eInvoice/Desktop123/\nMISAmeInvoice123_Setup_Server.exe\nBước 2: Nhấn chuột phải vào biểu tượng MeInvoice Server Mannage, chọn Run as adminstrator.\nhttps://helpv4.meinvoice.vn/wp-content/uploads/2019/12/thiet_lap_01.png\n\nBước 3: Nhấn Tạm dừng.\nhttps://helpv4.meinvoice.vn/wp-content/uploads/2019/12/thiet_lap_09.png\n\nBước 4: Nhấn Thiết lập để thiết lập thông tin dữ liệu:\n- Khai báo Mã số thuế của đơn vị.\n- Tại mục Máy chủ SQL: Nhấn biểu tượng mũi tên, chọn máy chủ lưu dữ liệu: thông thường tên máy chủ có dạng Computer name\\MEINVOICE (VD: NVANH2\\MEINVOICE).\n- Tại mục Thư mục chứa dữ liệu: Có thể nhấn biểu tượng dẫu 3 chấm, để thay đổi lại thư mục chứa dữ liệu theo nhu cầu (nếu cần).\n- Nhấn Đồng ý.\nhttps://helpv4.meinvoice.vn/wp-content/uploads/2019/12/r5_destop_thiet_lap_may_chu_24.png\n\nBước 5: Để các máy trạm có thể có thể ký số qua máy chủ mà không cần phải có chứng thư số, thì thực hiện như sau:\n1. Tích chọn Sử dụng chữ ký số tập trung\n2. Nhấn Thiết lập\nhttps://helpv4.meinvoice.vn/wp-content/uploads/2019/12/r5_destop_thiet_lap_may_chu_14.png\n3. Chọn loại chứng thư số mà đơn vị đang sử dụng.\nhttps://helpv4.meinvoice.vn/wp-content/uploads/2019/12/r5_destop_thiet_lap_may_chu_11.png\n4. Chọn chứng thư số.\n5. Nhấn OK.\nhttps://helpv4.meinvoice.vn/wp-content/uploads/2019/12/r5_destop_thiet_lap_may_chu_17.png\n6. Thiết lập Hình thức ký.\n- Tích chọn Ký tự động và Nhập mã pin chữ ký số.\nhttps://helpv4.meinvoice.vn/wp-content/uploads/2019/12/thiet_lap_19.png\n- Nếu yêu cầu máy trạm nhập mã pin khi thực hiện ký số thì tích chọn Không ký tự động.\nhttps://helpv4.meinvoice.vn/wp-content/uploads/2019/12/r5_destop_thiet_lap_may_chu.png\n- Nhấn Đồng ý.\n7. Nhấn Chạy/tiếp tục.\nhttps://helpv4.meinvoice.vn/wp-content/uploads/2019/12/thiet_lap_22.png\n\n\n2. Máy trạm\nBước 1: Cài đặt bộ cài máy chủ tại https://product.\nmisa.vn/\nmisasoftware/eInvoice/Desktop123/\nMISAmeInvoice123_Setup_Client.exe\nBước 2: Sau khi cài đặt xong bộ cài máy trạm, trên màn hình Desktop sẽ hiển thị biểu tượng của Máy trạm.\nBước 3: Nhấn đúp chuột vào biểu tượng Máy trạm để mở phần mềm.\nhttps://helpv4.meinvoice.vn/wp-content/uploads/2021/12/tai_bo_cai_03.png\n\nBước 4: Nhấn Tệp\\ chọn Thiết lập mô hình triển khai.\nBước 5: Chọn Nhiều người sử dụng phần mềm\\ nhấn Đồng ý.\nhttps://helpv4.meinvoice.vn/wp-content/uploads/2019/12/r18_desktop_dang_nhap_may_tram01.png\n\nBước 6: Khai báo các thông tin đăng nhập vào phần mềm.\nThông tin Máy chủ/Mã số thuế: Để biết thông tin Máy chủ/Mã số thuế thực hiện như sau: Trên máy tính cài đặt máy chủ, nhấn đúp chuột vào biểu tượng MeInvoice Sever Manager.\nhttps://helpv4.meinvoice.vn/wp-content/uploads/2019/12/r18_desktop_dang_nhap_may_tram03-1.png\n
MISA meInvoice Desktop - Thiết lập thông tin hồ sơ hóa đơn điện tử$Thiết lập thông tin hồ sơ hóa đơn điện tử$I. Dành cho khách hàng chuyển đổi từ hóa đơn theo NĐ 51/2010/NĐ-CP sang hóa đơn theo NĐ 123/2020/NĐ-CP\nBước 1: Vào mục Quy trình\\Hồ sơ hóa đơn điện tử.\nhttps://helpv4.meinvoice.vn/wp-content/uploads/2019/12/cap_nhat_thong_tin_don_vi_.png\n\nBước 2: Chọn hình thức hóa đơn sử dụng theo thông báo của CQT.\n\nBước 3: Cập nhật Thông tin liên hệ bao gồm Thông tin hiển thị trên hóa đơn điện tử và Thông tin hiển thị trên các hồ sơ gửi cơ quan thuế để cơ quan thuế gửi các thông báo về hóa đơn điện tử cho doanh nghiệp.\n\nBước 4: Nhấn Cất.\nhttps://helpv4.meinvoice.vn/wp-content/uploads/2019/12/cap_nhat_thong_tin_don_vi_01.png\n\n\nII. Dành cho khách hàng bắt đầu sử dụng hóa đơn điện tử theo nghị định 123/2020/NĐ-CP\nBước 1: Vào mục Quy trình\\Hồ sơ hóa đơn điện tử.\nhttps://helpv4.meinvoice.vn/wp-content/uploads/2019/12/cap_nhat_thong_tin_don_vi_.png\n\nBước 2: Khai báo các thông tin chi tiết của đơn vị.\nLưu ý:\n- Chọn đúng hình thức hóa đơn sử dụng của đơn vị.\n- Các thông tin có dấu * là thông tin bắt buộc nhập.\n- Thông tin Mã số thuế được tự động lấy theo mã số thuế sử dụng khi mua phần mềm meInvoice và không cho phép sửa lại.\n- Cần điền chính xác phần Thông tin liên hệ bao gồm Thông tin hiển thị trên hóa đơn điện tử và Thông tin hiển thị trên các hồ sơ gửi cơ quan thuế để cơ quan thuế gửi các thông báo về hóa đơn điện tử cho doanh nghiệp.\n- Có thể chọn nhanh Ngành nghề kinh doanh của đơn vị bằng cách gõ từ khóa tìm kiếm hoặc nhấn biểu tượng mũi tên để chọn trên danh sách chương trình đã thiết lập sẵn.\n\nBước 3: Nhấn Cất.\nhttps://helpv4.meinvoice.vn/wp-content/uploads/2019/12/cap_nhat_thong_tin_don_vi_01.png\n1. Các thông tin Tên đơn vị, Địa chỉ, Mã số thuế, Số điện thoại, Số TK ngân hàng sẽ được lấy tương ứng lên phần thông tin người bán trên hóa đơn.\n2. Các thông tin còn lại sẽ được ngầm định lấy lên các giao diện liên quan. Ví dụ: Khi lập Thông báo phát hành hóa đơn thông tin Cơ quan thuế sẽ ngầm định theo thông tin Cơ quan thuế quản lý khai báo ở trên.\n
