MISA meInvoice Quest$muốn đăng ký sử dụng hóa đơn không có mã của cơ quan thuế$Cách đăng ký sử dụng hóa đơn không có mã của cơ quan thuế:\nSau khi Thiết lập thông tin đơn vị và Thiết lập ký số, thực hiện như sau:\n1. Tại màn hình bắt đầu sử dụng, tích chọn Hóa đơn không có mã của CQT, nhấn Hoàn thiện tờ khai.\nhttps://helpv4.meinvoice.vn/wp-content/uploads/2019/12/r48_web_hoan_thien_to_khai_06-768x501.jpg\n2. Chương trình đã tạo sẵn 1 tờ khai trên danh sách, nhấn biểu tượng Xem để xem chi tiết và hoàn thiện tờ khai.\nKhai báo thông tin liên hệ với CQT:\nVới tờ khai Đăng ký mới: Sau khi tờ khai được chấp nhận, cơ quan thuế sẽ gửi thông tin tài khoản truy cập hệ thống HĐĐT của Tổng cục Thuế và các thông báo quan trọng liên quan đến hóa đơn điện tử tới email/số điện thoại/địa chỉ này.\nVới tờ khai Thay đổi thông tin: Sau khi tờ khai được chấp nhận, cơ quan thuế sẽ gửi các thông báo quan trọng liên quan đến hóa đơn điện tử tới email/số điện thoại/địa chỉ này.\nhttps://helpv4.meinvoice.vn/wp-content/uploads/2019/12/r48_web_hoan_thien_to_khai_07-768x495.jpg\n1. Hình thức hóa đơn: Không có mã của cơ quan thuế (Phần mềm tự động lấy lên theo thiết lập hình thức hóa đơn tại Hồ sơ điện tử). Trường hợp đơn vị sử dụng song song 2 hình thức hóa đơn thì tích chọn cả 2 hình thức.\n2. Hình thức gửi dữ liệu hóa đơn điện tử: Để trống toàn bộ ( nếu đơn vị không thuộc trường hợp không phải trả tiền dịch vụ theo khoản 1, điều 14, nghị định 123/2020/NĐ-CP.)\n3. Phương thức chuyển hóa đơn điện tử: Chọn 1 trong 2 phương thức:\nChuyển đầy đủ nội dung từng hóa đơn: Chương trình sẽ tự động chuyển dữ liệu hóa đơn đến cơ quan thuế ngay sau khi hóa đơn được phát hành và gửi cho khách hàng.\nChuyển theo bảng tổng hợp dữ liệu hóa đơn: Kế toán lập bảng tổng hợp dữ liệu hóa đơn gửi cơ quan thuế định kỳ theo kỳ kê khai thuế GTGT tại đơn vị.\nXem hướng dẫn chi tiết cách chọn phương thức chuyển dữ liệu hóa đơn đến cơ quan thuế tại đây.\n4. Loại hóa đơn sử dụng: Tích chọn vào 1 hoặc nhiều loại hóa đơn theo thực tế sử dụng của từng đơn vị. Bao gồm:\nHóa đơn bán hàng\nHóa đơn GTGT\nHóa đơn GTGT khởi tạo từ máy tính tiền\nHóa đơn bán hàng khởi tạo từ máy tính tiền\nCác loại hóa đơn khác: Vé điện tử\nChứng từ khác: Các loại phiếu xuất kho kiêm vận chuyển nội bộ, phiếu xuất kho hàng gửi bán đại lý.\nLưu ý: Nếu đơn vị sử dụng hóa đơn khởi tạo từ máy tính tiền. Xem chi tiết luồng nghiệp vụ tại đây.\n5. Danh sách chứng thư số sử dụng: Nhấn Chọn để lấy lên chứng thư số đơn vị sử dụng.\nNhấn Ký điện tử.\nhttps://helpv4.meinvoice.vn/wp-content/uploads/2019/12/r48_web_hoan_thien_to_khai_08.jpg\nNhấn Gửi để gửi tờ khai đến cơ quan thuế.\n3. Theo dõi kết quả đăng ký.\nCơ quan thuế sẽ phản hồi về việc chấp nhận/không chấp nhận đăng ký sử dụng hóa đơn đơn điện tử trong 01 ngày kể từ ngày nộp tờ khai.\nTheo dõi kết quả đăng ký tại mục Đăng ký/Thay đổi thông tin.\nhttps://helpv4.meinvoice.vn/wp-content/uploads/2019/12/r48_web_hoan_thien_to_khai_09-768x96.jpg\n\n
MISA meInvoice Quest$muốn xóa bỏ mẫu đã phát sinh số hóa đơn$muốn xóa bỏ mẫu đã phát sinh số hóa đơn được không:\nKhông, chương trình không cho phép xóa bỏ mẫu đã phát sinh số hóa đơn\n\n
MISA meInvoice Quest$sửa lại mẫu hóa đơn đã tạo$Có thể sửa lại mẫu hóa đơn đã tạo không:\nCó, bạn có thể xem/sửa lại mẫu hóa đơn đã khởi tạo hoặc khởi tạo mẫu hóa đơn mới.\n\n
MISA meInvoice Quest$tiêu hủy hóa đơn giấy đã thông báo phát hành nhưng chưa sử dụng$Cách tiêu hủy hóa đơn giấy đã thông báo phát hành nhưng chưa sử dụng:\nBước 1: Thành lập Hội đồng hủy hóa đơn\nDoanh nghiệp, tổ chức kinh tế phải thành lập Hội đồng tiêu hủy hóa đơn. Hội đồng hủy hóa đơn phải có đại diện lãnh đạo, đại diện bộ phận kế toán của tổ chức. Hộ, cá nhân kinh doanh không phải thành lập Hội đồng khi tiêu hủy hóa đơn và thực hiện các việc sau:\nLập Bảng kiểm kê hóa đơn cần hủy\nTiến hành hủy hóa đơn và Lập biên bản hủy hóa đơn\nThông báo kết quả hủy hóa đơn\nBước 2: Lập Bảng kiểm kê hóa đơn cần hủy\nTheo quy định tại Điểm d, Khoản 2, Điều 27 nghị định 123/NĐ-CP quy định về nội dung của Biên bản kiểm kê hóa đơn cần hủy như sau:\nBảng kiểm kê hóa đơn cần tiêu hủy ghi chi tiết: Tên hóa đơn, ký hiệu mẫu số hóa đơn, ký hiệu hóa đơn, số lượng hóa đơn hủy (từ số… đến số… hoặc kê chi tiết từng số hóa đơn nếu số hóa đơn cần hủy không liên tục)\nTrước khi hủy hóa đơn, Hội đồng kiểm kê phải tiến hành kiểm kê số hóa đơn cần hủy, với các chỉ tiêu như quy định trên. Hội đồng kiểm kê phải Lập bảng kiểm kê và ký xác nhận.\nBước 3: Tiến hành hủy hóa đơn và lập Biên bản hủy hóa đơn\nKhi hủy hóa đơn, Hội đồng phải lập biên bản hủy hóa đơn. Biên bản ghi rõ thông tin cần thiết của hóa đơn hủy như:\nLoại hóa đơn, Mẫu hóa đơn, Ký hiệu hóa đơn, từ quyển … đến quyển …, Từ số … đến số …\nHình thức hủy hóa đơn\nCắt góc\nXé nhỏ\nĐốt\nBiên bản được lập sau khi hóa đơn đã hủy và có chữ ký của những người trong Hội đồng hủy hóa đơn\nBước 4: Thông báo kết quả hủy hóa đơn\nLập thông báo kết quả hủy hóa đơn phải có nội dung theo Mẫu số 02/HUY-HĐG Phụ lục IA ban hành kèm theo Nghị định này.\nThông báo kết quả tiêu hủy hóa đơn được lập thành 02 bản, một bản lưu, một bản gửi đến cơ quan thuế quản lý trực tiếp chậm nhất không quá 05 ngày kể từ ngày thực hiện tiêu hủy hóa đơn.\nHồ sơ tiêu hủy hóa đơn được lưu tại doanh nghiệp, tổ chức kinh tế, hộ, cá nhân kinh doanh sử dụng hóa đơn.\n\n
MISA meInvoice Quest$Cách khai báo danh sách khách hàng, phục vụ cho việc lập và gửi hóa đơn điện tử cho khách hàng$Cách khai báo danh sách khách hàng, phục vụ cho việc lập và gửi hóa đơn điện tử cho khách hàng:\n2.1. Nhập khẩu danh sách khách hàng từ tệp excel\n1. Vào Danh mục, chọn Khách hàng.\n2. Nhấn Nhập khẩu.\nhttps://helpv3.meinvoice.vn/wp-content/uploads/2019/12/nhap_khau_khach_hang_01-1.png\nChi tiết các bước thực hiện xem hướng dẫn tại đây.\n2.2. Khai báo khách hàng\n1. Vào Danh mục, chọn Khách hàng.\n2. Nhấn Thêm mới.\n3. Khai báo thông tin khách hàng:\nhttps://helpv3.meinvoice.vn/wp-content/uploads/2019/12/nhap_khau_khach_hang_02.png\nLựa chọn khách hàng cần khai báo là Tổ chức hoặc Cá nhân.\nNhập Mã số thuế của khách hàng sau đó nhấn Lấy thông tin, chương trình tự động lấy lên Tên khách hàng và Địa chỉ theo dữ liệu của cơ quan thuế (hoặc có thể tự khai báo các thông tin này nếu muốn).\nVới tổ chức không có Mã số thuế thì bỏ trống thông tin này.\nLưu ý: Khi thực hiện chức năng Lấy thông tin từ Mã số thuế của khách hàng thì chương trình tự động kiểm tra tình trạng hoạt động của khách hàng đó:\nKhai báo các thông tin chi tiết khác về khách hàng => Bắt buộc phải khai báo các thông tin có ký hiệu (*)\nhttps://helpv3.meinvoice.vn/wp-content/uploads/2019/12/danh_muc_khach_hang.png\nLưu ý:\nKhi lập hóa đơn các thông tin: Mã số thuế, Tên khách hàng, Địa chỉ, Số TK ngân hàng, Tên ngân hàng, Người nhận hóa đơn, Email và Số điện thoại sẽ được tự động lấy lên theo thông tin tương ứng của Người mua hàng khai báo trên danh mục tương ứng với khách hàng được chọn.Vì vậy, để tiết kiệm thời gian và đảm bảo tính chính xác Kế toán nên khai báo đầy đủ và cẩn thận các thông tin này.\nChương trình sẽ gửi hóa đơn cho khách hàng theo thông tin của Người nhận hóa đơn (mặc định lấy theo thông tin Người mua hàng  và có thể sửa lại nếu cần) \n4. Nhấn Lưu.\n\n
MISA meInvoice Quest$Cách xóa khách hàng không còn giao dịch nữa ở mục Khách hàng$Cách xóa khách hàng không còn giao dịch nữa ở mục Khách hàng:\nVới các khách hàng không còn giao dịch nữa, nhấn Sửa và tích chọn Ngừng theo dõi => Khi lập hóa đơn điện tử, các khách hàng đã ngừng theo dõi sẽ không hiển thị tại mục Khách hàng nữa.\n\n
MISA meInvoice Quest$Trong mục Khách hàng, muốn xóa cùng lúc nhiều khách hàng$Trong mục Khách hàng, muốn xóa cùng lúc nhiều khách hàng\nĐể Xóa cùng lúc nhiều khách hàng: Giữ phím Ctrl và chọn các khách hàng muốn xóa, sau đó nhấn biểu tượng và chọn Xóa.\n\n
MISA meInvoice Quest$Trong mục Khách hàng, muốn khai báo nhanh khách hàng bằng cách sao chép lại thông tin của khách hàng khác đã khai báo$Trong mục Khách hàng, muốn khai báo nhanh khách hàng bằng cách sao chép lại thông tin của khách hàng khác đã khai báo:\nĐể Khai báo nhanh khách hàng bằng cách sao chép lại thông tin của khách hàng khác đã khai báo: Chọn khách hàng muốn sao chép thông tin, nhấn biểu tượng, chọn Nhân bản.\n\n
MISA meInvoice Quest$Trong mục Khách hàng, muốn Xuất khẩu danh sách khách hàng ra file excel$Trong mục Khách hàng, muốn Xuất khẩu danh sách khách hàng ra file excel:\nĐể Xuất khẩu danh sách khách hàng ra file excel: Nhấn biểu tượng, chọn Xuất khẩu\n\n
MISA meInvoice Quest$Trong mục Khách hàng, muốn cập nhật dữ liệu mới nhất do Thêm/Sửa/Xóa khách hàng$Trong mục Khách hàng, muốn cập nhật dữ liệu mới nhất do Thêm/Sửa/Xóa khách hàng:\nĐể Cập nhật dữ liệu mới nhất do Thêm/Sửa/Xóa khách hàng: Nhấn biểu tượng, chọn Nạp.\n\n
MISA meInvoice Quest$Trong mục Khách hàng, muốn tìm kiếm thông tin khách hàng$Trong mục Khách hàng, muốn tìm kiếm thông tin khách hàng:\nĐể Tìm kiếm khách hàng: Có thể tìm kiếm theo loại khách hàng hoặc gõ từ khóa tìm kiếm theo Mã số thuế, Mã khách hàng, Tên khách hàng và nhấn biểu tượng.\n\n
MISA meInvoice Quest$khai báo danh sách hàng hóa, dịch vụ phục vụ cho việc lập hóa đơn điện tử$khai báo danh sách hàng hóa, dịch vụ phục vụ cho việc lập hóa đơn điện tử:\nCách 1:  Nhập khẩu danh sách hàng hóa, dịch vụ từ tệp excel\n1. Vào Danh mục, chọn Hàng hóa, dịch vụ.\n2. Nhấn Nhập khẩu.\nhttps://helpv4.meinvoice.vn/wp-content/uploads/2019/12/khai_bao_hang_hoa_01-1024x379.png\nChi tiết các bước thực hiện xem hướng dẫn tại đây.\nCách 2: Khai báo hàng hóa, dịch vụ.\n1. Vào mục Danh mục, chọn Hàng hóa, dịch vụ.\n2. Nhấn Thêm mới.\nhttps://helpv4.meinvoice.vn/wp-content/uploads/2019/12/khai_bao_hang_hoa_02-1024x379.png\n3. Khai báo thông tin hàng hóa, dịch vụ.\nhttps://helpv4.meinvoice.vn/wp-content/uploads/2019/12/R30_web_them_HH_01.png\nLưu ý:\nBắt buộc phải khai báo các thông tin có ký hiệu (*).\nMục Nhóm HHDV, nếu khai báo:\nTrên Báo cáo thống kê số lượng hóa đơn đã phát hành sẽ thống kê được giá trị hóa đơn đã phát hành theo từng nhóm hàng hóa , dịch vụ phục vụ nhu cầu quản lý của đơn vị.\nĐể khai báo thông tin hàng hóa, dịch vụ theo nhóm cần thiết lập danh mục Nhóm hàng hóa, dịch vụ. Xem hướng dẫn tại đây.\nThuế GTGT (%): Nhập mức thuế suất tương ứng của hàng hóa, dịch vụ trong đó:\nMức KCT: dành cho hàng hóa, dịch vụ không chịu thuế.\nMức KKKNT: Thuế suất trống và tiền thuế bằng 0.\nMức KHAC: Thuế suất trống và tiền thuế >0 (thường sử dụng trong lĩnh vực Hàng Hải)\nhttps://helpv4.meinvoice.vn/wp-content/uploads/2019/12/R30_web_them_HH_02.png\nKhi lập hóa đơn, sau khi chọn hàng hóa, dịch vụ, các thông tin: Đơn vị tính, Đơn giá bán, Thuế suất GTGT (%) sẽ được lấy tương ứng lên hóa đơn.  Vì vậy, để tiết kiệm thời gian và đảm bảo tính chính xác Kế toán nên khai báo đầy đủ và cẩn thận các thông tin này.\n4. Nhấn Lưu.\n\n
MISA meInvoice Quest$Với các hàng hóa, dịch vụ không còn kinh doanh nữa thì làm cách nào để xóa khỏi cột Tên hàng hóa, dịch vụ$Xóa hàng hóa, dịch vụ khỏi côt Tên hàng hóa, dịch vụ:\nVới các Hàng hóa, dịch vụ không còn kinh doanh nữa, nhấn vào biểu tượng https://helpv4.meinvoice.vn/wp-content/uploads/2019/12/icon_sua.png \n, sau đó tích chọn Ngừng theo dõi => Khi lập hóa đơn điện tử, các Hàng hóa, dịch vụ đã ngừng theo dõi sẽ không hiển thị tại cột Tên hàng hóa, dịch vụ nữa.\nhttps://helpv4.meinvoice.vn/wp-content/uploads/2019/12/r18_Web_khai_bao_nhom_hang_hoa06-1024x516.jpg\n\n
MISA meInvoice Quest$Thay đổi lại thông tin Hàng hóa, dịch vụ$Thay đổi lại thông tin Hàng hóa, dịch vụ:\nVới các Hàng hóa, dịch vụ không còn kinh doanh nữa, nhấn vào biểu tượng https://helpv4.meinvoice.vn/wp-content/uploads/2019/12/icon_sua.png\n, sau đó tích chọn Ngừng theo dõi => Khi lập hóa đơn điện tử, các Hàng hóa, dịch vụ đã ngừng theo dõi sẽ không hiển thị tại cột Tên hàng hóa, dịch vụ nữa.\nhttps://helpv4.meinvoice.vn/wp-content/uploads/2019/12/r18_Web_khai_bao_nhom_hang_hoa06-1024x516.jpg\n\n
MISA meInvoice Quest$Trong danh mục Hàng hóa, dịch vụ, để thay đổi lại thông tin hàng hóa, dịch vụ$Trong danh mục Hàng hóa, dịch vụ, để thay đổi lại thông tin hàng hóa, dịch vụ:\nĐể Thay đổi lại thông tin Hàng hóa, dịch vụ: Nhấn biểu tượng https://helpv4.meinvoice.vn/wp-content/uploads/2019/12/icon_sua.png\n\n
MISA meInvoice Quest$Trong danh mục Hàng hóa, dịch vụ, để xóa thông tin hàng hóa, dịch vụ$Trong danh mục Hàng hóa, dịch vụ, để xóa thông tin hàng hóa, dịch vụ:\nĐể Xóa Hàng hóa, dịch vụ: Nhấn biểu tượng https://helpv4.meinvoice.vn/wp-content/uploads/2019/12/icon_daux.png\n\n
MISA meInvoice Quest$Trong danh mục Hàng hóa, dịch vụ, để xóa cùng lúc nhiều hàng hóa, dịch vụ$Trong danh mục Hàng hóa, dịch vụ, để xóa cùng lúc nhiều hàng hóa, dịch vụ:\nĐể Xóa cùng lúc nhiều Hàng hóa, dịch vụ: Giữ phím Ctrl và chọn các Hàng hóa, dịch vụ muốn xóa, sau đó nhấn biểu tượng https://helpv4.meinvoice.vn/wp-content/uploads/2019/12/icon_3chamngang.png và chọn Xóa\n\n
MISA meInvoice Quest$Trong danh mục Hàng hóa, dịch vụ, để xuất khẩu hàng hóa, dịch vụ$Trong danh mục Hàng hóa, dịch vụ, để xuất khẩu hàng hóa, dịch vụ:\nĐể Xuất khẩu danh sách Hàng hóa, dịch vụ ra file excel: Nhấn biểu tượng https://helpv4.meinvoice.vn/wp-content/uploads/2019/12/icon_3chamngang.png và chọn Xuất khẩu\n\n
MISA meInvoice Quest$Trong danh mục Hàng hóa, dịch vụ, để cập nhật dữ liệu mới nhất do Thêm/Sửa/Xóa Hàng hóa dịch vụ$Trong danh mục Hàng hóa, dịch vụ, để cập nhật dữ liệu mới nhất do Thêm/Sửa/Xóa Hàng hóa dịch vụ:\nĐể Cập nhật dữ liệu mới nhất do Thêm/Sửa/Xóa Hàng hóa, dịch vụ: Nhấn biểu tượng https://helpv4.meinvoice.vn/wp-content/uploads/2019/12/icon_3chamngang.png và chọn Nạp\n\n
MISA meInvoice Quest$Trong danh mục Hàng hóa, dịch vụ, để tìm kiếm Hàng hóa, dịch vụ$Trong danh mục Hàng hóa, dịch vụ, để tìm kiếm Hàng hóa, dịch vụ:\nĐể Tìm kiếm Hàng hóa, dịch vụ: Có thể gõ từ khóa tìm kiếm theo Mã Hàng hóa, dịch vụ, Tên Hàng hóa, dịch vụ và nhấn biểu tượng https://helpv4.meinvoice.vn/wp-content/uploads/2019/12/Group%2027.png\n\n
MISA meInvoice Quest$Bổ sung, sửa đổi hoặc xóa bỏ các loại tiền trong hóa đơn$Được bổ sung, sửa đổi hoặc xóa bỏ các loại tiền trong hóa đơn, phần mềm đã thiết lập sẵn danh sách các loại tiền thường được các doanh nghiệp giao dịch. Tuy nhiên, Kế toán vẫn có thể bổ sung, sửa đổi hoặc xóa bỏ các loại tiền đã có sao cho phù hợp với yêu cầu quản lý thực tế của doanh nghiệp để phục vụ cho việc xuất hóa đơn bằng ngoại tệ.\n Để làm điều đó:\n1. Vào mục Danh mục, chọn Loại tiền.\n2. Chọn loại tiền muốn sửa đổi thông tin, nhấn biểu tượng (hoặc nhấn Thêm mới để bổ sung loại tiền mới).\nhttps://helpv4.meinvoice.vn/wp-content/uploads/2017/04/khai_bao_loai_tien-1024x493.png\n3. Khai báo thông tin chi tiết về loại tiền:\nBắt buộc phải khai báo các thông tin có ký hiệu (*).\nNhập Tỷ giá quy đổi: Khi xuất hóa đơn bằng ngoại tệ chương trình sẽ ngầm định theo tỷ giá này, giúp tiết kiệm thời gian nhập liệu.\nThiết lập Cách đọc số tiền bằng chữ để hiển thị trên các hóa đơn in ra:\nTỷ lệ chuyển đổi: Là tỷ lệ chuyển đổi giữa loại tiền và số tiền sau thập phân (Ví dụ: 1 đô la mỹ = 100 xen)\nSau khi thiết lập xong cách đọc số tiền bằng chữ: nhập số tiền rồi nhấn Đọc để xem trước cách hiển thị số tiền trên hóa đơn in ra.\nhttps://helpv4.meinvoice.vn/wp-content/uploads/2020/04/r22_Web_loai_tien02.png\nLưu ý: Để lấy lại cách đọc loại tiền ngầm định của chương trình nhấn Lấy ngầm định.\n4. Nhấn Lưu.\nLưu ý:\nNhấn biểu tượng nếu muốn thay đổi lại thông tin loại tiền đã khai báo.\nVới các loại tiền không có nhu cầu theo dõi nữa, sử dụng chức năng Sửa, sau đó tích chọn Ngừng theo dõi => Khi lập hóa đơn điện tử bằng ngoại tệ, các Loại tiền đã ngừng theo dõi sẽ không hiển thị tại mục Loại tiền nữa.\nhttps://helpv4.meinvoice.vn/wp-content/uploads/2020/04/r22_Web_loai_tien03.png\n\n
MISA meInvoice Quest$Xóa đơn vị khi đã phát sinh hóa đơn tại đơn vị$Không thể xóa đơn vị trong trường hợp đã có người dùng thuộc đơn vị, đã có người dùng được phân quyền làm việc trên đơn vị, đã phát sinh hóa đơn tại đơn vị\n\n
MISA meInvoice Quest$Quản lý nhân viên trên danh sách hóa đơn$Có, nếu đơn vị có quản lý nhân viên trên danh sách hóa đơn thì có thể phân công và quản lý nhân viên theo từng đơn vị.\nKhai báo thêm thông tin đơn vị cho nhân viên.\nhttps://helpv4.meinvoice.vn/wp-content/uploads/2021/05/r35.4_quan_ly_nhan_vien_tren_danh_sach_01.png\nKhi lập hóa đơn thì khai báo nhân viên như bình thường.\n\n
MISA meInvoice Quest$Nghiệp vụ xử lý hóa đơn sai sót trên hóa đơn của từng đơn vị$Nghiệp vụ xử lý hóa đơn sai sót thực hiện như bình thường, thông tin đơn vị trên hóa đơn sẽ được chương trình tự động lấy lên theo thông tin trên hóa đơn gốc. Trên danh sách hóa đơn điều chỉnh, thay thế, xóa bỏ cũng hiển thị thông tin Đơn vị và có thể lọc danh sách theo từng đơn vị.\n\n
MISA meInvoice Quest$Trong trường hợp người bán tự phát hiện sai sót của hóa đơn điện tử, chưa gửi cho khách hàng$Trong trường hợp người bán tự phát hiện sai sót của hóa đơn điện tử, chưa gửi cho khách hàng:\nBước 1: Hủy hóa đơn sai sót.\nBước 2: Lập và phát hành hóa đơn mới gửi cho khách hàng.\nBước 3: Thông báo với cơ quan thuế về hóa đơn sai sót.\n\n
MISA meInvoice Quest$Trong trường hợp người bán phát hiện sai sót sau khi gửi hóa đơn điện tử cho khách hàng, sai về Tên, Địa chỉ người mua, các thông tin khác không sai só$Trong trường hợp người bán phát hiện sai sót sau khi gửi hóa đơn điện tử cho khách hàng, sai về Tên, Địa chỉ người mua, các thông tin khác không sai sót:\nBước 1: Thông báo với cơ quan thuế về hóa đơn sai sót.\nBước 2: Thông báo cho người mua về hóa đơn sai sót và không phải lập lại hóa đơn.\n\n
MISA meInvoice Quest$Trong trường hợp người bán tự phát hiện sai sót sau khi gửi hóa đơn điện tử cho khách hàng, sai về Mã số thuế; sai Số tiền ghi trên hóa đơn; sai Tiền thuế; Thuế suất; hoặc Hàng hóa ghi trên hóa đơn không đúng quy cách, chất lượng$Trong trường hợp người bán tự phát hiện sai sót sau khi gửi hóa đơn điện tử cho khách hàng, sai về Mã số thuế; sai Số tiền ghi trên hóa đơn; sai Tiền thuế; Thuế suất; hoặc Hàng hóa ghi trên hóa đơn không đúng quy cách, chất lượng:\nNgười bán và người mua tự thỏa thuận với nhau để chọn 1 trong 2 cách giải quyết.\nCách 1: Lập hóa đơn điều chỉnh cho hóa đơn sai sót.\nCách 2: Hủy hóa đơn sai sót và lập hóa đơn thay thế.\n\n
MISA meInvoice Quest$Trong trường hợp Cơ quan thuế phát hiện sau sót và thông báo đến người bán$Trong trường hợp Cơ quan thuế phát hiện sau sót và thông báo đến người bán:\nCơ quan thuế sẽ gửi thông báo rà soát trực tiếp qua email của người nộp thuế.\nBước 1: Lập hóa đơn điều chỉnh cho hóa đơn sai sót hoặc Hủy hóa đơn sai sót và lập hóa đơn thay thế theo thỏa thuận với người mua.\nBước 2: Thông báo với cơ quan thuế về hóa đơn điện tử sai sót\n
MISA meInvoice Quest$Muốn thay đổi thông tin liên hệ cơ quan thuế thì làm thế nào$Cũng trong mục Hồ sơ hóa đơn điện tử, tại phần Thông tin liên hệ, nhấn biểu tượng hình bút.\nhttps://helpv4.meinvoice.vn/wp-content/uploads/2021/10/thay-doi-thong-tin-lien-he-768x392.png\nCập nhật thông tin mới. Nhấn Lưu\nhttps://helpv4.meinvoice.vn/wp-content/uploads/2021/10/chinh-sua-luu-768x494.png\n
MISA meInvoice Quest$Có thể ký số bằng những hình thức nào trên meInvoice$Trên meInvoice hiện cho phép ký bằng 3 hình thức là:\nKý trực tiếp qua USB\nKý thông qua chữ ký số từ xa \nMISA eSign\nKý thông qua máy chủ HSM\n
MISA meInvoice Quest$Muốn sửa thông tin liên hệ cơ quan thuế thì làm cách nào$Cũng trong mục Hồ sơ hóa đơn điện tử, tại phần Thông tin liên hệ, nhấn biểu tượng hình bút.\nhttps://helpv4.meinvoice.vn/wp-content/uploads/2021/10/thay-doi-thong-tin-lien-he-768x392.png\nCập nhật thông tin mới. Nhấn Lưu\nhttps://helpv4.meinvoice.vn/wp-content/uploads/2021/10/chinh-sua-luu-768x494.png\n
MISA meInvoice Quest$Hướng dẫn ký trực tiếp qua máy chủ HSM$Ví dụ: Kết nối với nhà cung cấp Cyber HSM, thực hiện tương tự khi kết nối với các nhà cung cấp còn lại.\nNhấn chọn nhà cung cấp Cyber HSM.\nhttps://helpv4.meinvoice.vn/wp-content/uploads/2017/12/thiet_lap_ky_so_04-768x247.jpg\nKhai báo thông tin kết nối (Do đơn vị cung cấp dịch vụ cung cấp), nhấn Đồng ý.\nhttps://helpv4.meinvoice.vn/wp-content/uploads/2017/12/thiet_lap_ky_so_05.jpg\n
