MISA meInvoice Desktop - Thiết lập ký số$Thiết lập ký số$Bước 1: Vào menu Hệ thống, chọn Thiết lập ký số.\n\n\nBước 2: Chọn hình thức ký số của đơn vị, thiết lập thông tin và nhấn Đồng ý.\nTrường hợp 1: Sử dụng dịch vụ chữ ký điện tử \nMISA.\n1. Nhấn chọn Dịch vụ chữ ký số điện tử \nMISA eSign\n2. Nhấn Kết nối ngay.\nhttps://helpv4.meinvoice.vn/wp-content/uploads/2020/03/r14_desktop_thiets_lap_ky_so12.jpg\n3. Đăng nhập tài khoản eSign\n- Khai báo thông tin tài khoản \nMISA eSign(là thông tin Số điện thoại, email đã đăng ký khi mua chứng thư cung cấp hồ sơ được yêu cầu)\n- Nhấn Đăng nhập.\nhttps://helpv4.meinvoice.vn/wp-content/uploads/2020/03/r14_desktop_thiets_lap_ky_so02.jpg\n4. Nhập mã xác thực ký số(do chương trình cung cấp qua số điện thoại/email đăng ký dịch vụ chữ ký số điện tử \nMISA)\\ nhấn Đồng ý.\nhttps://helpv4.meinvoice.vn/wp-content/uploads/2020/03/r14_desktop_thiets_lap_ky_so03.jpg\n5. Nhấn Đồng ý.\nTrường hợp dịch vụ \nMISA eSign đã hết hạn, thực hiện gia hạn bằng cách nhấn Gia hạn.\nhttps://helpv4.meinvoice.vn/wp-content/uploads/2020/03/r14_desktop_thiets_lap_ky_so04.jpg\n\nTrường hợp 2: Ký trực tiếp qua USB\n1. Nhấn Ký trực tiếp qua USB.\n2. Chọn hình thức cắm USB.\n- Đối với đơn vị sử dụng mô hình 1 người dùng.\n+ Nhấn USB cắm trên máy tính.\n+ Nhấn Đồng ý.\nhttps://helpv4.meinvoice.vn/wp-content/uploads/2020/03/r14_desktop_thiets_lap_ky_so07.jpg\n- Đối với đơn vị sử dụng mô hình nhiều người dùng\nKý thông qua máy chủ: Với hình thức này, chỉ cần cắm USB Token vào máy chủ, các máy trạm kết nối với máy chủ để ký điện tử => Áp dụng với đơn vị có nhiều máy tính cùng thực hiện ký điện tử lên hóa đơn.\n\nTrường hợp 3: Ký thông qua máy chủ HSM\n1. Nhấn Ký thông qua máy chủ HSM.\n2. Chọn Hệ thống ký số của Viettel/HSM mà đơn vị đang sử dụng và khai báo tài khoản.\n3. Nhấn Đồng ý.\nhttps://helpv4.meinvoice.vn/wp-content/uploads/2020/03/r14_desktop_thiets_lap_ky_so13.jpg\n
MISA meInvoice Desktop - Khởi tạo mẫu hóa đơn$Chuyển mẫu hóa đơn đang sử dụng theo nghị định 51/2010/NĐ-CP sang mẫu hóa đơn 123/2020/NĐ-CP$Bước 1: Vào mục Mẫu hóa đơn, nhấn Thêm, chọn Chuyển từ mẫu cũ theo NĐ51.\nhttps://helpv4.meinvoice.vn/wp-content/uploads/2021/12/desktop_chuyen_doi_mau_hoa_don_01.png\n\n\nBước 2: Chương trình hiển thị danh sách mẫu hóa đơn theo nghị định 51/2010/NĐ-CP, tại mẫu hóa đơn cần chuyển đổi sang nghị định 123/2020/NĐ-CP, nhấn Chuyển đổi.\nLưu ý:\n- Có thể xem lại mẫu hóa đơn trước khi chuyển đổi bằng cách nhấn Xem.\n- Với mẫu hóa đơn khởi tạo từ phần mềm MIMOSA và mẫu hóa đơn khởi tạo trước ngày 06/10/2020 thì không thể chuyển đổi lên mẫu hóa đơn theo nghị định 123/2020/NĐ-CP (chương trình sẽ hiển thị trạng thái Không thể chuyển đổi)\n- Hiện tại, danh sách mẫu hóa đơn theo nghị định 51/2010/NĐ-CP vẫn lấy lên cả những mẫu đã được chuyển đổi.\nhttps://helpv4.meinvoice.vn/wp-content/uploads/2021/12/desktop_chuyen_doi_mau_hoa_don_02.png\n\n\nBước 3: Khai báo thông tin mẫu hóa đơn theo nghị định 123/2020/NĐ-CP.\nhttps://helpv4.meinvoice.vn/wp-content/uploads/2021/12/desktop_chuyen_doi_mau_hoa_don_03.png\n\n\nBước 4: Trên danh sách mẫu hóa đơn hiển thị thông tin hóa đơn đã chuyển đổi.\nhttps://helpv4.meinvoice.vn/wp-content/uploads/2021/12/desktop_chuyen_doi_mau_hoa_don_04.png\n
MISA meInvoice Desktop - Phân quyền sử dụng hóa đơn điện tử$Phân quyền sử dụng hóa đơn điện tử$Bước 1: Đăng nhập vào phần mềm.\n\n\nBước 2: Vào mục Hệ thống\\Quản lý người dùng. Nhấn Thêm trên thanh công cụ.\nhttps://helpv4.meinvoice.vn/wp-content/uploads/2019/12/r18_desktop_quan_ly_nguoi_dung02.png\n\n\nBước 3: Khai báo thông tin người dùng.\n1. Thiết lập Vai trò cho người dùng:\n- Quản trị: Được thực hiện tất cả chức năng và có quyền với tất cả các mẫu hóa đơn trên phần mềm.\n- Người dùng: Không có quyền phân quyền (không nhìn thấy mục Quản lý người dùng), Xác nhận thỏa thuận sử dụng dịch vụ và chỉ có quyền làm việc với các mẫu hóa đơn được phân quyền.\nhttps://helpv4.meinvoice.vn/wp-content/uploads/2019/12/r18_desktop_phan_quyen_03.png\n\n2. Phân quyền chức năng cho người dùng.\n- Phân quyền từng hoạt động tương ứng với từng chức năng ( Đối với vai trò Người dùng)\n+ Chọn tab Phân quyền chức năng.\n+ Chọn chức năng trên màn hình danh sách chức năng.\n+ Tích chọn các hoạt động cho phép người dùng sử dụng tương ứng với chức năng đó. \nhttps://helpv4.meinvoice.vn/wp-content/uploads/2019/12/R25_desktop_phan_quyen_danh_muc.png\n- Khai báo mẫu hóa đơn được phép sử dụng (đối với vai trò Người dùng)\n+ Chọn tab Phân quyền mẫu hóa đơn.\n+ Tích chọn mẫu hóa đơn cho phép người dùng sử dụng.\nhttps://helpv4.meinvoice.vn/wp-content/uploads/2019/12/r11_desktop_Phan_quyen_su_dung_hoa_don05.jpg\n\n\nBước 4: Nhấn Cất hoặc Cất & Thêm.\n\n\nBước 5: Sau khi được phân quyền, người dùng sẽ nhận được 1 email thông báo cấp quyền sử dụng meInvoice.vn.\n\n\nBước 6: Người dùng đăng nhập meInvoice Desktop để kích hoạt tài khoản.\nNhấn Đăng nhập ngay.\nhttps://helpv4.meinvoice.vn/wp-content/uploads/2019/12/r18_desktop_dang_nhap_sau_khi_duoc_phan-quyen2-768x388.png\n\n\nLưu ý:\n1. Tài khoản Quản trị có thể phân quyền lại chức năng người dùng đã thêm bằng cách nhấn chức năng Sửa trên thanh công cụ.\nĐể cắt quyền sử dụng phần mềm, tích chọn Ngừng theo dõi => Khi đó, người dùng này sẽ không thể đăng nhập vào phần mềm được nữa.\nhttps://helpv4.meinvoice.vn/wp-content/uploads/2019/12/r11_desktop_Phan_quyen_su_dung_hoa_don06.jpg\n\n2. Tài khoản Quản trị có thể xóa người dùng bằng cách nhấn nút Xóa trên thanh công cụ.\n\n3. Khi đăng nhập vào phần mềm với vai trò Người dùng, kế toán chỉ có thể làm việc với các mẫu hóa đơn được phân quyền sử dụng (Ví dụ: Danh sách hóa đơn, Danh sách xóa hóa đơn, Phát hành hóa đơn hàng loạt, Chuyển thành chứng từ giấy hàng loạt, Tải hóa đơn hàng loạt, Xóa bỏ hóa đơn, lập Hóa đơn thay thế, lập Hóa đơn điều chỉnh, Xem hóa đơn)\n
MISA meInvoice Desktop - Khai báo danh mục$Khai báo danh mục khách hàng$Bước 1: Vào phân hệ Danh mục, chọn Khách hàng.\nBước 2: Nhấn Thêm.\nBước 3: Khai báo thông tin khách hàng:\n- Lựa chọn khách hàng cần khai báo là Tổ chức hoặc Cá nhân.\n- Khai báo các thông tin chi tiết về khách hàng => Bắt buộc phải khai báo các thông tin có ký hiệu (*).\nLưu ý: Thông tin người mua hàng trên hóa đơn sẽ được lấy theo thông tin người mua hàng khai báo tại danh mục khách hàng.\nhttps://helpv4.meinvoice.vn/wp-content/uploads/2019/12/r18_desktop_tach_thong_tin_nguoi_mua_hang08.jpg\n\nBước 4: Nhấn Cất.\nLưu ý:\n- Nhấn Sửa nếu muốn thay đổi lại thông tin khách hàng đã khai báo.\n- Với các khách hàng không còn giao dịch nữa, sử dụng chức năng Sửa, sau đó tích chọn Ngừng theo dõi => Khi lập hóa đơn điện tử, các khách hàng đã ngừng theo dõi sẽ không hiển thị tại mục Khách hàng nữa.\nhttps://helpv4.meinvoice.vn/wp-content/uploads/2019/12/r18_desktop_tach_thong_tin_nguoi_mua_hang09.jpg\n
MISA meInvoice Desktop - Khai báo danh mục$Khai báo danh mục hàng hóa, dịch vụ$Bước 1: Vào phân hệ Danh mục, chọn Hàng hóa, dịch vụ.\nBước 2: Nhấn Thêm.\nBước 3: Khai báo thông tin hàng hóa, dịch vụ.\nLưu ý:\n- Bắt buộc phải khai báo các thông tin có ký hiệu (*).\n- Các thông tin: Đơn vị tính, Đơn giá bán, Thuế suất GTGT (%), Tỷ lệ CK (%) sẽ được lấy lên hóa đơn tương ứng với từng Mã hàng hóa. Vì vậy, để tiết kiệm thời gian và đảm bảo tính chính xác Kế toán nên khai báo đầy đủ và cẩn thận các thông tin này.\nhttps://helpv4.meinvoice.vn/wp-content/uploads/2019/12/R1_hanghoa_01.png\n\nBước 4: Nhấn Cất.\nLưu ý:\n- Nhấn Sửa nếu muốn thay đổi lại thông tin vật tư, hàng hóa đã khai báo.\n- Với các vật tư, hàng hóa không kinh doanh nữa, sử dụng chức năng Sửa, sau đó tích chọn Ngừng theo dõi => Khi lập hóa đơn điện tử, các Hàng hóa, dịch vụ đã ngừng theo dõi sẽ không hiển thị tại cột Mã hàng nữa.\nhttps://helpv4.meinvoice.vn/wp-content/uploads/2019/12/R1_hanghoa_02.png\n
MISA meInvoice Desktop - Khai báo danh mục$Khai báo danh mục loại tiền$Bước 1: Vào phân hệ Danh mục, chọn Loại tiền.\nBước 2: Chọn loại tiền muốn sửa đổi thông tin, nhấn Sửa (hoặc nhấn Thêm để bổ sung loại tiền mới).\nhttps://helpv4.meinvoice.vn/wp-content/uploads/2019/12/loai_tien_01.png\n\nBước 3: Khai báo thông tin chi tiết về loại tiền:\nLưu ý:\n- Bắt buộc phải khai báo các thông tin có ký hiệu (*).\n- Nhập Tỷ giá quy đổi: Khi xuất hóa đơn bằng ngoại tệ chương trình sẽ ngầm định theo tỷ giá này, giúp tiết kiệm thời gian nhập liệu.\n- Thiết lập Cách đọc số tiền bằng chữ để hiển thị trên các hóa đơn in ra:\n+ Tỷ lệ chuyển đổi: Là tỷ lệ chuyển đổi giữa loại tiền và số tiền sau thập phân (Ví dụ: 1 đô la mỹ = 100 xen)\n+ Sau khi thiết lập xong cách đọc số tiền bằng chữ: nhập số tiền rồi nhấn Đọc để xem trước cách hiển thị số tiền trên hóa đơn in ra.\nhttps://helpv4.meinvoice.vn/wp-content/uploads/2019/12/loai_tien_02.png\n\nBước 4: Nhấn Cất.\nLưu ý:\n- Nhấn Sửa nếu muốn thay đổi lại thông tin loại tiền đã khai báo.\n- Với các loại tiền không có nhu cầu theo dõi nữa, sử dụng chức năng Sửa, sau đó tích chọn Ngừng theo dõi => Khi lập hóa đơn điện tử bằng ngoại tệ, các Loại tiền đã ngừng theo dõi sẽ không hiển thị tại mục Loại tiền nữa.\nhttps://helpv4.meinvoice.vn/wp-content/uploads/2019/12/loai_tien_03.png\n- Có thể xuất khẩu danh sách Loại tiền ra file excel bằng cách sử dụng chức năng Xuất khẩu\nhttps://helpv4.meinvoice.vn/wp-content/uploads/2019/12/loai_tien_04.png\n
MISA meInvoice Desktop - Khai báo danh mục$Khai báo hình thức thanh toán$Bước 1: Vào phân hệ Danh mục, chọn Hình thức thanh toán.\n\nBước 2: Chọn hình thức thanh toán muốn sửa đổi thông tin, nhấn Sửa (hoặc nhấn Thêm để bổ sung hình thức thanh toán mới).\nhttps://helpv4.meinvoice.vn/wp-content/uploads/2019/12/Hinh_thuc_thanh_toan_danh_sach.png\n\nBước 3: Khai báo thông tin chi tiết về hình thức thanh toán:\nLưu ý: Bắt buộc phải khai báo các thông tin có ký hiệu (*).\nhttps://helpv4.meinvoice.vn/wp-content/uploads/2019/12/Hinh_thuc_thanh_toan_sua_chi_tiet.png\n\nBước 4: Nhấn Cất.\nLưu ý:\n- Nhấn Thêm hoặc Nhân bản nếu muốn thêm hình thức thanh toán mới.\n- Với các hình thức thanh toán không có nhu cầu theo dõi nữa, sử dụng chức năng Xóa hoặc Sửa trên thanh công cụ để xóa hoặc sửa hình thức thanh toán, sau đó tích chọn Ngừng theo dõi\nhttps://helpv4.meinvoice.vn/wp-content/uploads/2019/12/Hinh_thuc_thanh_toan_sua_ngung_theo_doi.png\n\n\n


MISA meInvoice Mobile - Cài đặt và đăng nhập áp vé điện tử trên máy Pos Sunmi, Mobile$Cài đặt và đăng nhập áp vé điện tử trên máy Pos Sunmi, Mobile$Lưu ý: Thiết bị đáp ứng:\nMáy Pos sunmi hệ điều hành: Android.\nMobile hệ điều hành Android, IOS.\n1. Cài đặt\nVào chợ ứng dụng, gõ từ khóa “Vé điện tử“\nChọn App vé điện tử\nNhấn tải và đợi cho đến khi ứng dụng được tải về máy.\n2. Đăng nhập\nĐăng nhập app vé điện tử bằng tài khoản dùng để đăng nhập phần mềm \nMISA meInvoice.\nLưu ý: Vé điện tử là app độc lập, không dùng chung với app meInvoice mobile.\n
MISA meInvoice Mobile - Cài đặt ứng dụng meInvoice Mobile$Cài đặt ứng dụng meInvoice Mobile$1. Vào chợ ứng dụng.\nhttps://helpv4.meinvoice.vn/wp-content/uploads/2019/05/cai_dat_01-320x676.png\n2. Gõ từ khóa “meinvoice”\nhttps://helpv4.meinvoice.vn/wp-content/uploads/2019/05/cai_dat-2-320x676.png\n3. Nhấn Cài đặt và đợi đến khi ứng dụng được tải về máy.1. Vào chợ ứng dụng.\nhttps://helpv4.meinvoice.vn/wp-content/uploads/2019/05/cai_dat-3-1-320x676.png\nĐăng nhập app vé điện tử bằng tài khoản dùng để đăng nhập phần mềm \nMISA meInvoice.\nLưu ý: Vé điện tử là app độc lập, không dùng chung với app meInvoice mobile.\n
MISA meInvoice Mobile - Đăng nhập vào ứng dụng meInvoice Mobile$Đăng nhập vào ứng dụng meInvoice Mobile$1. Mở ứng dụng meInvoice Mobile.\nhttps://helpv4.meinvoice.vn/wp-content/uploads/2019/05/mo_ung_dung-2-320x674.png\n2. Nhấn Đăng nhập.\nhttps://helpv4.meinvoice.vn/wp-content/uploads/2019/05/dang_nhap-1-1-320x676.png\n3. Khai báo thông tin đăng nhập (là tài khoản để đăng nhập vào \nMISA MEINVOICE Web)\nhttps://helpv4.meinvoice.vn/wp-content/uploads/2020/06/r7_mobile_dang_nhap_01.jpg\nLưu ý: Trường hợp quên mật khẩu có thể lấy lại mật khẩu bằng cách nhấn Quên mật khẩu, xem hướng dẫn tương tự tại đây.\n4. Nhấn Đăng nhập.\n5. Nếu tài khoản đăng nhập có thiết lập bảo mật 2 lớp. Chương trình yêu cầu nhập mã xác thực.\nNhập mã xác thực.\nNếu không check vào “Không hỏi lại trên thiết bị này” thì mỗi lần đăng nhập đều hiển thị giao diện nhập mã xác thực 2 bước.\nNếu check vào “Không hỏi lại trên thiết bị này” thì từ lần đăng nhập sau sẽ không hiển thị bước nhập mã xác thực 2 bước nữa (nhập đúng mật khẩu thì sẽ đăng nhập được vào phần mềm)\nNhấn Tiếp theo.\nhttps://helpv4.meinvoice.vn/wp-content/uploads/2020/06/r7_mobile_dang_nhap_02.jpg\nLưu ý: Có thể thay đổi phương thực nhận mã xác thực bằng cách nhấn Thử cách khác sau đó chọn phương thức nhận.\nhttps://helpv4.meinvoice.vn/wp-content/uploads/2020/06/r7_mobile_dang_nhap_03-1.jpg\n
MISA meInvoice Mobile - Khai báo danh mục$Khai báo danh mục hàng hóa, dịch vụ$1. Vào mục Khác\\ chọn Hàng hóa, dịch vụ.\nhttps://helpv4.meinvoice.vn/wp-content/uploads/2020/06/r7_mobile_danh_muc_hnag-hoa01.jpg\n2. Nhấn biểu tượng để thêm mới hàng hóa, dịch vụ.\nhttps://helpv4.meinvoice.vn/wp-content/uploads/2020/06/r7_mobile_danh_muc_hnag-hoa02.jpg\n3. Khai báo thông tin hàng hóa, dịch vụ.\nLưu ý :\nBắt buộc phải khai báo các thông tin có dấu (*).\nCác thông tin: Đơn vị tính, Giá bán, Thuế suất GTGT (%), Tỷ lệ CK (%) sẽ được lấy lên hóa đơn tương ứng với từng Mã hàng hóa.\n4. Nhấn Thêm.\nhttps://helpv4.meinvoice.vn/wp-content/uploads/2020/06/r7_mobile_danh_muc_hnag-hoa05.jpg\n
MISA meInvoice Mobile - Có mã cơ quan thuế$Lập hóa đơn có mã của Cơ quan thuế$Lưu ý: Trên meInvoice mobile có thể lập hóa đơn có mẫu hóa đơn là:\n\nCác mẫu hóa đơn cơ bản đã được thông báo phát hành trên meInvoice.vn Web, meInvoice Desktop, và các phần mềm tích hợp khác (SME, MIMOSA, ACT…).\nCác mẫu hóa đơn cơ bản có thiết lập trường thông tin mở rộng được thông báo phát hành trên meInvoice Web. Xem chi tiết tại đây.\nKhi lập hóa đơn có mẫu số, ký hiệu áp dụng quy trình phê duyệt hóa đơn, xem hướng dẫn gửi duyệt tại đây.\n1.  Nhấn biểu tượng.\nhttps://helpv4.meinvoice.vn/wp-content/uploads/2022/03/lap_hd_01-1-144x300.png\n2. Chọn mẫu hóa đơn.\nNhấn vào mục Mẫu hóa đơn.\nhttps://helpv4.meinvoice.vn/wp-content/uploads/2022/03/lap_hd_02-1-150x300.png\nChọn mẫu hóa đơn muốn sử dụng bằng cách: tìm kiếm theo mẫu số hoặc ký hiệu hóa đơn trên thanh tìm kiếm hoặc bằng cách vuốt màn hình sang trái.\nNhấn Chọn mẫu này.\nhttps://helpv4.meinvoice.vn/wp-content/uploads/2022/03/lap_hd_03-147x300.png\n3. Khai báo thông tin khách hàng:\nNhấn vào mục Khách hàng\nhttps://helpv4.meinvoice.vn/wp-content/uploads/2022/03/lap_hd_04-150x300.png\nNếu đã khai báo danh mục khách hàng: Chọn khách hàng trên danh sách (có thể tìm nhanh bằng cách nhập từ khóa theo Tên, Số điện thoại, Mã số thuế của khách hàng).\nhttps://helpv4.meinvoice.vn/wp-content/uploads/2022/03/lap_hd_05-1-153x300.png\n\nLưu ý:\nCó thể lập hóa đơn cho đơn vị là tổ chức không có mã số thuế (bỏ trống thông tin Mã số thuế của người mua\nDanh mục Khách hàng khai báo trên meInvoice.vn Web sẽ được lấy xuống meInvoice Mobile và ngược lại.\n4. Chọn Hình thức thanh toán.\nLưu ý: Có thể đánh dấu trạng thái Đã thanh toán cho hóa đơn đã được khách hàng thanh toán tiền trước nhằm phục vụ công tác quản lý:\nTrên danh sách, hóa đơn sẽ được đánh dấu Đã thanh toán\nKhi người mua tra cứu hóa đơn sẽ hiển thị tình trạng thanh toán là Đã thanh toán.\nhttps://helpv4.meinvoice.vn/wp-content/uploads/2022/03/lap_hd_06-1-150x300.png\n5. Khai báo hàng hóa ,dịch vụ\nNhấn Thêm hàng hóa dịch vụ.\nhttps://helpv4.meinvoice.vn/wp-content/uploads/2022/03/lap_hd_07-150x300.png\nNếu đã khai báo danh mục hàng hóa, dịch vụ: Chọn hàng hóa trên danh sách (có thể chọn nhiều hàng hóa, dịch vụ cùng lúc), nhấn Hoàn tất.\nCó thể tìm nhanh hàng hóa bằng cách nhập từ khóa theo Tên, Mã hàng hóa.\nNếu chưa khai báo danh mục hàng hóa dịch vụ: Nhấn biểu tượng để thêm mới hàng hóa ,dịch vụ. Xem hướng dẫn tại đây.\nhttps://helpv4.meinvoice.vn/wp-content/uploads/2022/03/lap_hd_08-1-139x300.png\nLưu ý: \nNếu muốn thay đổi lại thông tin của hàng hóa hoặc khai báo bổ sung các thông tin khác như Tỷ lệ chiết khấu, Tiền chiết khấu, Hàng khuyến mại thì:\nNhấn vào dòng hàng hóa cần thay đổi thông tin.\nNhập thông cần thay đổi, sau đó nhấn Đồng ý.\nDanh mục Hàng hóa, dịch vụ khai báo trên meInvoice.vn Web sẽ được lấy xuống meInvoice Mobile và ngược lại.\n6. Nhấn Lưu hoặc Lưu và phát hành nếu muốn phát hành ngay hóa đơn.\nhttps://helpv4.meinvoice.vn/wp-content/uploads/2022/03/lap_hd_09-1-149x300.png\n7. Tích chọn Gửi hóa đơn cho khách hàng: nếu muốn chương trình tự động gửi thông tin về hóa đơn điện tử cho khách hàng ngay sau khi nhận được mã của cơ quan thuế.\nhttps://helpv4.meinvoice.vn/wp-content/uploads/2022/03/lap_hd_10-1-148x300.png\n8. Nhấn Phát hành, lựa chọn chứng thư số, chương trình đồng thời cấp số hóa đơn và phát hành hóa đơn điện tử. Sau khi phát hành thành công, hóa đơn được gửi lên cơ quan thuế chờ cấp mã.\nTrường hợp hóa đơn hợp lệ, cơ quan thuế thực hiện cấp mã và gửi về thông điệp kết quả cấp mã của cơ quan thuế, hệ thống đồng thời cập nhật Mã của cơ quan thuế trạng thái hóa đơn thành Đã cấp mã.\nhttps://helpv4.meinvoice.vn/wp-content/uploads/2022/03/lap_hd_11-300x198.png\nTrường hợp hóa đơn không hợp lệ, cơ quan thuế thực hiện cấp mã và gửi về thông điệp kết quả kiểm tra dữ liệu hóa đơn điện tử – hóa đơn không đủ điều kiện cấp mã, hệ thống cập nhật trạng thái hóa đơn thành Từ chối cấp mã.\nLưu ý:\nHóa đơn lập trên meInvoice Mobile sẽ được lấy lên danh sách hóa đơn của meInvoice.vn Web và ngược lại.\nCó thể đánh dấu hóa đơn Đã thanh toán sau khi lập phục vục công tác quản lý.\n\n\n

MISA meInvoice Quest$Trước khi đăng ký sử dụng hóa đơn với cơ quan thuế, tôi cần phải làm gì$Trước khi đăng ký sử dụng hóa đơn với cơ quan thuế,:\nBạn cần Thiết lập thông tin đơn vị và Thiết lập chữ ký số\n\n
MISA meInvoice Quest$Không sửa được mã số thuế trên meInvoice$Có sửa được mã số thuế trên meInvoice không:\nThông tin Mã số thuế được tự động lấy theo mã số thuế sử dụng khi mua phần mềm \nMISA meInvoice và không cho phép sửa lại.\n\n
MISA meInvoice Quest$Trước đó doanh nghiệp có hóa đơn giấy đã thông báo phát hành nhưng chưa sử dụng có cần hủy không$Trước đó doanh nghiệp có hóa đơn giấy đã thông báo phát hành nhưng chưa sử dụng có cần hủy không:\nCó, sau khi được cơ quan thuế chấp nhận sử dụng hóa đơn điện tử theo Nghị định 123, doanh nghiệp phải thực hiện thủ tục hủy hóa đơn giấy và hủy hóa đơn điện tử đã phát hành theo các quy định trước đó.\n\n
MISA meInvoice Quest$Hướng dẫn ký trực tiếp qua chữ ký số từ xa$Hướng dẫn tôi Ký trực tiếp qua chữ ký số từ xa \nMISA eSign được không\nNhấn Kết nối ngay.\nhttps://helpv4.meinvoice.vn/wp-content/uploads/2017/12/thiet_lap_ky_so_02-768x304.jpg\nKhai báo thông tin kết nối (Do \nMISA cung cấp sau khi mua \nMISA eSign), nhấn Đồng ý.\nhttps://helpv4.meinvoice.vn/wp-content/uploads/2017/12/thiet_lap_ky_so_03.jpg\nLưu ý: Trường hợp tài khoản kết nối có thiết lập xác thực 2 lớp, chương trình sẽ hiển thị giao diện yêu cầu nhập mã xác thực.\nNhập mã xác thực được gửi đến số điện thoại đăng ký tài khoản \nMISA eSign, nhấn Xác thực.\nhttps://helpv4.meinvoice.vn/wp-content/uploads/2017/12/xac_thuc_\nmisa_id_02-1.jpg\nLưu ý: Có thể thay đổi phương thức nhận mã xác thực bằng cách nhấn Thử cách khác.\nhttps://helpv4.meinvoice.vn/wp-content/uploads/2017/12/xac_thuc_\nmisa_id_03.jpg\n\n
MISA meInvoice Quest$Khi ký vào tờ khai báo lỗi “Ký điện tử không thành công” thì phải làm gì$Khi ký vào tờ khai báo lỗi “Ký điện tử không thành công”ì\nCách khắc phục:\nBước 1: Cài đặt \nMISA KYSO phiên bản mới trên máy theo hướng dẫn Tại đây\nBước 2: Thực hiện ký lại tờ khai.\nLƯU Ý: Nếu gặp trường hợp cài xong chạy Tool \nMISA KYSO báo lỗi .NET 4.6.2 (như hình) khi dùng Win 7 SP1 thì xử lý theo hướng dẫn:\nhttps://helpv3.meinvoice.vn/wp-content/uploads/2021/11/loi-dotnet.jpg\nBước 1 : Thực hiện add Cert .NET theo hướng dẫn tại đây.\nBước 2: Tải bộ cài .NET 4.6.2 tại đây để cài đặt\nBước 3: Trên màn hình máy tính mở \nMISA KYSO lên và Ký tờ khai lại.\nhttps://helpv3.meinvoice.vn/wp-content/uploads/2021/11/\nmisa-ky-so.jpg\nLưu ý: Đối với win 7.0 và win 8 nếu không cài được theo hướng dẫn vui lòng cài lại windows (khuyến khích win 10)\n\n
